Behavioral decision,DiskChecker can fail to detect total disk controller failures indefinitely We have seen this in real clusters DiskChecker performs simple permissions based checks on directories which do not guarantee that any disk IO will be attempted A simple improvement is to write some data and flush it to the disk DiskChecker should perform some disk IO
Non-existence - ban decision,The DiskChecker class has a few unused public methods We can remove them Cleanup DiskChecker interface
Structural decision,To make our tests robust against timing problems and eventual consistent stores we need to do more spin wait for state We have some we ve examples to follow Some of that work has been reimplemented slightly in S ATestUtils eventually I propose adding a class in the test tree Eventually to be a successor replacement for these has an eventually waitfor operation taking a predicate that throws an exception has an evaluate exception which tries to evaluate an answer until the operation stops raising an exception again from scalatest plugin backoff strategies from Scalatest lets you do exponential as well as linear option of adding a special handler to generate the failure exception e g run more detailed diagnostics for the exception text etc be Java lambda expression friendly be testable and tested itself Add LambdaTestUtils class for tests fix eventual consistency problem in contract test setup
Behavioral decision,The runCommand code in Shell java can get into a situation where it will ignore InterruptedExceptions and refuse to shutdown due to being in I O waiting for the return value of the subprocess that was spawned We need to allow for the subprocess to be interrupted and killed when the shell process gets killed Currently the JVM will shutdown and all of the subprocesses will be orphaned and not killed Ability to clean up subprocesses spawned by Shell when the process exits
Non-existence - ban decision,Per discussion on HADOOP I d like to revert HADOOP It removes a deprecated API but the x line does not have a release with the new replacement API This places a burden on downstream applications Revert HADOOP Remove unused TrashPolicy getInstance and initialize code
Behavioral decision,Add a new instrumented read write lock in hadoop common so that the HDFS can use this to improve the locking in FsDatasetImpl Add a new instrumented read write lock
Non-existence - ban decision,We generate source code with line numbers for inclusion in the javadoc JARs Given that there s github and other online viewers this doesn t seem so useful these days Disabling the linkSource option saves us MB for the hadoop common javadoc jar Stop bundling HTML source code in javadoc JARs
Structural decision,Currently downstream projects that want to integrate with different Hadoop compatible file systems like WASB and S A need to list dependencies on each one This creates an ongoing maintenance burden for those projects because they need to update their build whenever a new Hadoop compatible file system is introduced This issue proposes adding a new artifact that transitively includes all Hadoop compatible file systems Similar to hadoop client this new artifact will consist of just a pom xml listing the individual dependencies Downstream users can depend on this artifact to sweep in everything and picking up a new file system in a future version will be just a matter of updating the Hadoop dependency version Provide a unified dependency artifact that transitively includes the cloud storage modules shipped with Hadoop
Structural decision,The newly added Kafka module defines the Kafka dependency as Reduce Kafka dependencies in hadoop kafka module
Behavioral decision,As work continues on HADOOP it s become evident that we need better hooks to start daemons as specifically configured users Via the command subcommand USER environment variables in x we actually have a standardized way to do that This in turn means we can make the sbin scripts super functional with a bit of updating Consolidate start dfs sh and start secure dns sh into one script Make start sh and stop sh know how to switch users when run as root Undeprecate start stop all sh so that it could be used as root for production purposes and as a single user for non production users Update scripts to be smarter when running with privilege
Structural decision,We re currently pulling in version incubating I think we should upgrade to the latest incubating Upgrade HTrace version
Structural decision,We re currently pulling in version I think we should upgrade to the latest Upgrade commons configuration version to
Structural decision,add a metadata file giving the FS impl of swift remove the entry from core default xml swift FS to add a service load metadata file
Behavioral decision,The UGI has a background thread to renew the tgt On exception it terminates itself https github com apache hadoop blob bee f f ca f ade c fd b dad a hadoop common project hadoop common src main java org apache hadoop security UserGroupInformation java L L If something temporarily goes wrong that results in an IOE even if it recovered no renewal will be done and client will eventually fail to authenticate We should retry with our best effort until tgt expires in the hope that the error recovers before that Retry until TGT expires even if the UGI renewal thread encountered exception
Structural decision,Based on discussion at YETUS this code can t go there but it s still very useful for release managers A similar variant of this script has been used for a while by Apache HBase and Apache Kudu and IMO JACC output is easier to understand than JDiff Incorporate checkcompatibility script which runs Java API Compliance Checker
Structural decision,ZStandard https github com facebook zstd has been used in production for months by facebook now v was recently released Create a codec for this library Add Codec for ZStandard Compression
Behavioral decision,Leveraging HADOOP will allow non rpc calls to be added to the call queue This is intended to support routing webhdfs calls through the call queue to provide a unified and protocol independent QoS Support external calls in the RPC call queue
Behavioral decision,This patch adds to fs shell Stat java the missing options of a and A FileStatus already contains the getPermission method required for returning symbolic permissions FsPermission contains the method to return the binary short but nothing to present in standard Octal format Most UNIX admins base their work on such standard octal permissions Hence this patch also introduces one tiny method to translate the toShort return into octal Build has already passed unit tests and javadoc Add A and a formats for fs stat command to print permissions
Structural decision,Introduce an AutoCloseableLock class that is a thin wrapper over RentrantLock It allows using RentrantLock with try with resources syntax The wrapper functions perform no expensive operations in the lock acquire release path Add an AutoCloseableLock class
Behavioral decision,The RPC layer supports QoS but other protocols ex webhdfs are completely unconstrained Generalizing Server Call to be extensible with simple changes to the handlers will enable unifying the call queue for multiple protocols Design Server Call to be extensible for unified call queue
Non-existence - ban decision,Shell java has a hardcoded path to bin bash which is not correct on all platforms Pointed out by aw while reviewing HADOOP Remove hardcoded absolute path for shell executable
Non-existence - ban decision,We re cleaning up Hive and Spark s use of FileSystem exists because it is often the case we see code of exists open exists delete when the exists probe is needless Against object stores expensive needless Hadoop can set an example here by stripping them out It will also show where there are opportunities to optimise things better and or improve reporting Eliminate needless uses of FileSystem exists isFile isDirectory
Behavioral decision,Umbrella jira for y optimizations to reduce object allocations more efficiently use protobuf APIs unified ipc and webhdfs callq to enable QoS etc IPC layer optimizations
Behavioral decision,Currently KMS audit log is using log j to write a text format log We should refactor this so that people can easily add new format audit logs The current text format log should be the default and all of its behavior should remain compatible Allow pluggable audit loggers in KMS
Non-existence - ban decision,In branch and later the patches for various child and related bugs listed in HADOOP most recently including HADOOP HADOOP HADOOP HADOOP and HDFS eliminate all use of commons httpclient from Hadoop and its sub projects except for hadoop tools hadoop openstack see HADOOP However after incorporating these patches commons httpclient is still listed as a dependency in these POM files hadoop project pom xml hadoop yarn project hadoop yarn hadoop yarn registry pom xml We wish to remove these but since commons httpclient is still used in many files in hadoop tools hadoop openstack we ll need to add the dependency to hadoop tools hadoop openstack pom xml We ll add a note to HADOOP to undo this when commons httpclient is removed from hadoop openstack In this was mostly done by HADOOP but the version info formerly inherited from hadoop project pom xml also needs to be added so that is in the branch version of the patch Other projects with undeclared transitive dependencies on commons httpclient previously provided via hadoop common or hadoop client may find this to be an incompatible change Of course that also means such project is exposed to the commons httpclient CVE and needs to be fixed for that reason as well remove unneeded commons httpclient dependencies from POM files in Hadoop and sub projects
Structural decision,Update WASB driver to use the latest version of SDK for Microsoft Azure Storage Clients We are currently using version of the SDK Version brings some breaking changes Need to fix code to resolve all these breaking changes and certify that everything works properly Update WASB driver to use the latest version of SDK for Microsoft Azure Storage Clients
Non-existence - ban decision,Right now the git repo has a branch named master in addition to our trunk branch Since master is the common place name of the most recent branch in git repositories this is misleading to new folks It looks like the branch is from months ago We should remove it delete spurious master branch
Behavioral decision,Big features like YARN demonstrate that even senior level Hadoop developers forget that daemons need a custom OPTS env var We can replace all of the custom vars with generic handling just like we do for the username check For example with generic handling in place Old Var New Var HADOOP NAMENODE OPTS HDFS NAMENODE OPTS YARN RESOURCEMANAGER OPTS YARN RESOURCEMANAGER OPTS n a YARN TIMELINEREADER OPTS n a HADOOP DISTCP OPTS n a MAPRED DISTCP OPTS HADOOP DN SECURE EXTRA OPTS HDFS DATANODE SECURE EXTRA OPTS HADOOP NFS SECURE EXTRA OPTS HDFS NFS SECURE EXTRA OPTS HADOOP JOB HISTORYSERVER OPTS MAPRED HISTORYSERVER OPTS This makes it a consistent across the entire project b consistent for every subcommand c eliminates almost all of the custom appending in the case statements It s worth pointing out that subcommands like distcp that sometimes need a higher than normal client side heapsize or custom options are a huge win Combined with hadooprc and or dynamic subcommands it means users can easily do customizations based upon their needs without a lot of weirdo shell aliasing or one line shell scripts off to the side Deprecate HADOOP SERVERNAME OPTS replace with command subcommand OPTS
Structural decision, Update maven enforcer plugin version to
Behavioral decision,Current ViewFileSystem does not support storage policy related API it will throw UnsupportedOperationException ViewFileSystem should support storage policy related API
Behavioral decision,In HADOOP the Guava cache was introduced to allow refreshes on the Namenode group cache to run in the background avoiding many slow group lookups Even with this change I have seen quite a few clusters with issues due to slow group lookups The problem is most prevalent in HA clusters where a slow group lookup on the hdfs user can fail to return for over seconds causing the Failover Controller to kill it The way the current Guava cache implementation works is approximately On initial load the first thread to request groups for a given user blocks until it returns Any subsequent threads requesting that user block until that first thread populates the cache When the key expires the first thread to hit the cache after expiry blocks While it is blocked other threads will return the old value I feel it is this blocking thread that still gives the Namenode issues on slow group lookups If the call from the FC is the one that blocks and lookups are slow if can cause the NN to be killed Guava has the ability to refresh expired keys completely in the background where the first thread that hits an expired key schedules a background cache reload but still returns the old value Then the cache is eventually updated This patch introduces this background reload feature There are two new parameters hadoop security groups cache background reload default false to keep the current behaviour Set to true to enable a small thread pool and background refresh for expired keys hadoop security groups cache background reload threads only relevant if the above is set to true Controls how many threads are in the background refresh pool Default is which is likely to be enough Reload cached groups in background after expiry
Structural decision,This JIRA is to address Jing s comments https issues apache org jira browse HADOOP focusedCommentId page com atlassian jira plugin system issuetabpanels comment tabpanel comment in HADOOP AsyncCallHandler should use an event driven architecture to handle async calls
Behavioral decision,In current Async DFS implementation file system calls are invoked and returns Future immediately to clients Clients call Future get to retrieve final results Future get internally invokes a chain of callbacks residing in ClientNamenodeProtocolTranslatorPB ProtobufRpcEngine and ipc Client The callback path bypasses the original retry layer logic designed for synchronous DFS This proposes refactoring to make retry also works for Async DFS Support async call retry and failover
Structural decision,This is a follow up jira from HADOOP Now with the findbug warning As discussed in HADOOP bq Why was this committed with a findbugs errors rather than adding the necessary plumbing in pom xml to make it go away we will add the findbugsExcludeFile xml and will get rid of this given kerby rc release Add the kerby version hadoop project pom xml bq hadoop project pom xml contains the dependencies of all libraries used in all modules of hadoop under dependencyManagement Only here version will be mentioned All other Hadoop Modules will inherit hadoop project so all submodules will use the same version In submodule version need not be mentioned in pom xml This will make version management easier Follow on fixups after upgraded mini kdc using Kerby
Structural decision,slaves sh and the slaves file should get replace with workers sh and a workers file replace slaves with workers
Structural decision,Upgrade yetus wrapper to be now that it has passed vote Upgrade to Apache Yetus
Non-existence - ban decision,The hadoop ant code is an ancient kludge unlikely to have any users still We can delete it from trunk as a scream test for x Remove hadoop ant from hadoop tools
Behavioral decision,Currently the Future returned by ipc async call only support Future get but not Future get timeout unit We should support the latter as well Support Future get with timeout in ipc async calls
Non-existence - ban decision,We should slim down the Docker image by removing JDK now that trunk no longer supports it remove JDK from Dockerfile
Behavioral decision,After DistCp copies a file it calls getFileStatus to get the FileStatus from the destination so that it can compare to the source and update metadata if necessary If the DistCp command was run without the option to preserve metadata attributes then this additional getFileStatus call is wasteful In DistCp prevent unnecessary getFileStatus call when not preserving metadata
Structural decision,We want to rename to alpha for the first alpha release However the version number is also encoded outside of the pom xml s so we need to update these too Change project version from to alpha
Behavioral decision,LdapGroupsMapping currently does not set timeouts on the LDAP queries This can create a risk of a very long infinite wait on a connection Support timeouts in LDAP queries in LdapGroupsMapping
Behavioral decision,Currently FileSystem Statistics exposes the following statistics BytesRead BytesWritten ReadOps LargeReadOps WriteOps These are in turn exposed as job counters by MapReduce and other frameworks There is logic within DfsClient to map operations to these counters that can be confusing for instance mkdirs counts as a writeOp Proposed enhancement Add a statistic for each DfsClient operation including create append createSymlink delete exists mkdirs rename and expose them as new properties on the Statistics object The operation specific counters can be used for analyzing the load imposed by a particular job on HDFS For example we can use them to identify jobs that end up creating a large number of files Once this information is available in the Statistics object the app frameworks like MapReduce can expose them as additional counters to be aggregated and recorded as part of job summary Add a new interface for retrieving FS and FC Statistics
Structural decision,The jira proposes an improvement over HADOOP to remove webhdfs dependencies from the ADL file system client and build out a standalone client At a high level this approach would extend the Hadoop file system class to provide an implementation for accessing Azure Data Lake The scheme used for accessing the file system will continue to be adl azuredatalake net path to file The Azure Data Lake Cloud Store will continue to provide a webHDFS rest interface The client will access the ADLS store using WebHDFS Rest APIs provided by the ADLS store Refactor Azure Data Lake Store as an independent FileSystem
Behavioral decision,Cross Frame Scripting XFS prevention for UIs can be provided through a common servlet filter This filter will set the X Frame Options HTTP header to DENY unless configured to another valid setting There are a number of UIs that could just add this to their filters as well as the Yarn webapp proxy which could add it for all it s proxied UIs if appropriate Add XFS Filter for UIs to Hadoop Common
Behavioral decision,This allows metrics collector such as AMS to collect it with MetricsSink The per user RPC call counts schedule decisions and per priority response time will be useful to detect and trouble shoot Hadoop RPC server such as Namenode overload issues Support MetricsSource interface for DecayRpcScheduler Metrics
Non-existence - ban decision,As per comment https issues apache org jira browse HADOOP focusedCommentId page com atlassian jira plugin system issuetabpanels comment tabpanel comment from wheat in HADOOP Need to remove FileUtil copyMerge CC to wheat Remove FileUtil copyMerge
Behavioral decision,In async RPC if the callers don t read replies fast enough the buffer storing replies could be used up This is to propose limiting the number of outstanding async calls to eliminate the issue Limit the number of outstanding async calls
Behavioral decision,HADOOP added a ShutdownHookManager to be used by different components instead of the JVM shutdownhook For each of the shutdown hook registered we currently don t have an upper bound for its execution time We have seen namenode failed to shutdown completely waiting for shutdown hook to finish after failover for a long period of time which breaks the namenode high availability scenarios This ticket is opened to allow specifying a timeout value for the registered shutdown hook ShutdownHookManager should have a timeout for each of the Registered shutdown hook
Behavioral decision,Currently the dfs test command only supports d e f s z options It would be helpful if we add w r to verify permission of r w before actual read or write This will help script programming Add w r options in dfs test command
Behavioral decision,Umbrella for converting hadoop hdfs mapred and yarn to allow for dynamic subcommands See first comment for more details Umbrella Dynamic subcommands for hadoop shell scripts
Behavioral decision,Currently back off policy from HADOOP is hard coded to base on whether call queue is full This ticket is open to allow flexible back off policies such as moving average of response time in RPC calls of different priorities Allow RPC scheduler callqueue backoff using response times
Structural decision,As discussed in the mailing list we d like to introduce Apache Kerby into Hadoop Initially it s good to start with upgrading Hadoop MiniKDC with Kerby offerings Apache Kerby https github com apache directory kerby as an Apache Directory sub project is a Java Kerberos binding It provides a SimpleKDC server that borrowed ideas from MiniKDC and implemented all the facilities existing in MiniKDC Currently MiniKDC depends on the old Kerberos implementation in Directory Server project but the implementation is stopped being maintained Directory community has a plan to replace the implementation using Kerby MiniKDC can use Kerby SimpleKDC directly to avoid depending on the full of Directory project Kerby also provides nice identity backends such as the lightweight memory based one and the very simple json one for easy development and test environments Upgrade Hadoop MiniKDC with Kerby
Behavioral decision,In ipc Client the underlying mechanism is already supporting asynchronous calls the calls shares a connection the call requests are sent using a thread pool and the responses can be out of order Indeed synchronous call is implemented by invoking wait in the caller thread in order to wait for the server response In this JIRA we change ipc Client to support asynchronous mode In asynchronous mode it return once the request has been sent out but not wait for the response from the server Change ipc Client to support asynchronous calls
Structural decision,Update Yetus to Update Yetus to
Non-existence - ban decision,We should use ResourceManager and NodeManager instead of JobTracker and TaskTracker Remove MRv terms from HttpAuthentication md
Behavioral decision,gridmix shouldn t require a raw java command line to run add a subcommand for gridmix
Non-existence - ban decision,When o a h record was moved bin rcc was never updated to pull those classes from the streaming jar Remove bin rcc script
Behavioral decision,As discussed in mailing list this will disable style checks in class setters like the following Disable hiding field style checks in class setters
Structural decision,As hadoop tools grows bigger and bigger it s becoming evident that having a single directory that gets sucked in is starting to become a big burden as the number of tools grows Let s rework this to be smarter Rework hadoop tools
Structural decision,Let s pull the shell code out of the hadoop dist pom xml pull shell code out of hadoop dist
Behavioral decision,Java supports TLSv and TLSv which are more secure than TLSv which was all that was supported in Java so we should add those to the default list for hadoop ssl enabled protocols Enable TLS v and
Structural decision,The HBase s HMaster port number conflicts with Hadoop kms port number Both uses There might be use cases user need kms and HBase present on the same cluster The HBase is able to encrypt its HFiles but user might need KMS to encrypt other HDFS directories Users would have to manually override the default port of either application on their cluster It would be nice to have different default ports so kms and HBase could naturally coexist Change kms server port number which conflicts with HMaster port number
Behavioral decision,The typical LDAP group name resolution works well under typical scenarios However we have seen cases where a user is mapped to many groups in an extreme case a user is mapped to more than groups The way it s being implemented now makes this case super slow resolving groups from ActiveDirectory The current LDAP group resolution implementation sends two queries to a ActiveDirectory server The first query returns a user object which contains DN distinguished name The second query looks for groups where the user DN is a member If a user is mapped to many groups the second query returns all group objects associated with the user and is thus very slow After studying a user object in ActiveDirectory I found a user object actually contains a memberOf field which is the DN of all group objects where the user belongs to Assuming that an organization has no recursive group relation that is a user A is a member of group G and group G is a member of group G we can use this properties to avoid the second query which can potentially run very slow I propose that we add a configuration to only enable this feature for users who want to reduce group resolution time and who does not have recursive groups so that existing behavior will not be broken Faster LDAP group name resolution with ActiveDirectory
Non-existence - ban decision,Remove getaclstatus call for non acl commands in getfacl Remove getaclstatus call for non acl commands in getfacl
Structural decision,Various SSL security fixes are needed See CVE CVE CVE CVE update apache httpclient version to httpcore to
