Non-existence - ban decision,Union Distinct has two Distinct that generate two Aggregation in the plan Remove an Extra Distinct in Union
Non-existence - ban decision,For lots of SQL operators we have metrics for both of input and output the number of input rows should be exactly the number of output rows of child we could only have metrics for output rows After we improve the performance using whole stage codegen the overhead of SQL metrics are not trivial anymore we should avoid that if it s not necessary Some of the operator does not have SQL metrics we should add that for them For those operators that have the same number of rows from input and output for example Projection we may don t need that Remove duplicated SQL metrics
Non-existence - ban decision,in newMutableProjection it will fallback to InterpretedMutableProjection if failed to compile Since we remove the configuration for codegen we are heavily reply on codegen also TungstenAggregate require the generated MutableProjection to update UnsafeRow should remove the fallback which could make user confusing see the discussion in SPARK Remove fallback in codegen
Behavioral decision,Spark SQL should collapse adjacent Repartition operators and only keep the last one Collapse adjacent Repartition operations
Behavioral decision,We currently delegate most DDLs directly to Hive through NativePlaceholder in HiveQl scala In Spark we want to provide native implementations for DDLs for both SQLContext and HiveContext The first step is to properly parse these DDLs and then create logical commands that encapsulate them The actual implementation can still delegate to HiveNativeCommand As an example we should define a command for RenameTable with the proper fields and just delegate the implementation to HiveNativeCommand we might need to track the original sql query in order to run HiveNativeCommand but we can remove the sql query in the future once we do the next step Once we flush out the internal persistent catalog API we can then switch the implementation of these newly added commands to use the catalog API Create native DDL commands
Structural decision,When you define a class inside of a package object the name ends up being something like org mycompany project package MyClass However when reflect on this we try and load org mycompany project MyClass Support for classes defined in package objects
Non-existence - ban decision, remove GenericInternalRowWithSchema
Behavioral decision,As of Spark Spark SQL internally has only a limited catalog and does not support any of the DDLs This is an umbrella ticket to introduce an internal API for a system catalog and the associated DDL implementations using this API Native database table system catalog
Behavioral decision,The StateDStream currently does not provide the batch time as input to the state update function This is required in cases where the behavior depends on the batch start time We Conviva have been patching it manually for the past several Spark versions but we thought it might be useful for others as well Add API for updateStateByKey to provide batch time as input
Behavioral decision,Implement a simple wrapper in SparkR to support k means K means wrapper in SparkR
Behavioral decision,Implement a simple wrapper of AFTSurvivalRegression in SparkR to support survival analysis Survival analysis in SparkR
Behavioral decision,Parquet files benefit from vectorized decoding ColumnarBatches have been designed to support this This means that a single encoded parquet column is decoded to a single ColumnVector Vectorize parquet decoding using ColumnarBatch
Structural decision,As benchmarked and discussed here https github com apache spark pull files r Benefits from codegen the declarative aggregate function could be much faster than imperative one we should re implement all the builtin aggregate functions as declarative one For skewness and kurtosis we need to benchmark it to make sure that the declarative one is actually faster than imperative one Reimplement stat functions as declarative function
Structural decision,I was investingating progress in SPARK and I noticed that there is no TrainValidationSplit class in pyspark ml tuning module Java Scala s examples SPARK use org apache spark ml tuning TrainValidationSplit that is not available from Python and this blocks SPARK Does the class have different name in PySpark maybe Also I couldn t find any JIRA task to saying it need to be implemented Is it by design that the TrainValidationSplit estimator is not ported to PySpark If not that is if the estimator needs porting then I would like to contribute TrainValidationSplit is missing in pyspark ml tuning
Non-existence - ban decision,CacheManager directly calls MemoryStore unrollSafely and has its own logic for handling graceful fallback to disk when cached data does not fit in memory However this logic also exists inside of the MemoryStore itself so this appears to be unnecessary duplication Thanks to the addition of block level read write locks we can refactor the code to remove the CacheManager and replace it with an atomic getOrElseUpdate BlockManager method Remove CacheManager and replace it with new BlockManager getOrElseUpdate method
Behavioral decision,In Spark MLlib provides logistic regression and linear regression with L L elastic net regularization We want to expand the support of generalized linear models GLMs in e g Poisson Gamma families and more link functions SPARK implements a GLM solver for the case when the number of features is small We also need to design an interface for GLMs In SparkR we can simply follow glm or glmnet On the Python Scala Java side the interface should be consistent with LinearRegression and LogisticRegression e g from GeneralizedLinearModel Estimator interface for generalized linear models GLMs
Behavioral decision,As a pre requisite to off heap caching of blocks we need a mechanism to prevent pages blocks from being evicted while they are being read With on heap objects evicting a block while it is being read merely leads to memory accounting problems because we assume that an evicted block is a candidate for garbage collection which will not be true during a read but with off heap memory this will lead to either data corruption or segmentation faults To address this we should add a reference counting mechanism to track which blocks pages are being read in order to prevent them from being evicted prematurely I propose to do this in two phases first add a safe conservative approach in which all BlockManager get calls implicitly increment the reference count of blocks and where tasks references are automatically freed upon task completion This will be correct but may have adverse performance impacts because it will prevent legitimate block evictions In phase two we should incrementally add release calls in order to fix the eviction of unreferenced blocks The latter change may need to touch many different components which is why I propose to do it separately in order to make the changes easier to reason about and review Use reference counting to prevent blocks from being evicted during reads
Structural decision,It would be easier to fix bugs and maintain the ec script separately from Spark releases For more information see https issues apache org jira browse SPARK Move spark ec scripts to AMPLab
Behavioral decision,Right now We use a Filter follow SortMergeJoin or BroadcastHashJoin for conditions the result projection of join could be very expensive if they generate lots of rows could be reduce mostly by condition SortMergeJoin and BroadcastHashJoin should support condition
Structural decision,Our current Intersect physical operator simply delegates to RDD intersect We should remove the Intersect physical operator and simply transform a logical intersect into a semi join This way we can take advantage of all the benefits of join implementations e g managed memory code generation broadcast joins Rewrite Intersect phyiscal plan using semi join
Behavioral decision,Add hash function for SparkR SparkR support hash function
Behavioral decision,This is beneficial just from a code testability point of view to be able to exercise individual components Also makes it easy to benchmark it It would be able to read data without need to create al the associate hadoop input split etc components Expose API on UnsafeRowRecordReader to just run on files
Non-existence - ban decision,Before https github com apache spark pull submitJob would create a separate thread to wait for the job result submitJobThreadPool was a workaround in ReceiverTracker to run these waiting job result threads Now https github com apache spark pull has been merged to master and resolved this blocking issue submitJobThreadPool can be removed now Remove submitJobThreadPool since submitJob doesn t create a separate thread to wait for the job result
Non-existence - ban decision,MLlib s Transformer uses the deprecated callUDF API Remove the use of the deprecated callUDF in MLlib
Structural decision,Right now numFields will be passed in by pointTo then bitSetWidthInBytes is calculated making pointTo a little bit heavy It should be part of constructor of UnsafeRow The numFields of UnsafeRow should not changed by pointTo
Behavioral decision, Support window functions in SQLContext
Behavioral decision, Support intersect except in Hive SQL
Behavioral decision,cc nongli please attach the design doc bucketed table support
Behavioral decision,We can provides the option to choose JSON parser can be enabled to accept quoting of all character or not For example if JSON file that includes not listed by JSON backslash quoting specification it returns corrupt record This issue similar to HIVE HIVE Add option to accept quoting of all character backslash quoting mechanism
Structural decision,Right now the Java users cannot use ActorHelper because it uses special Scala syntax This patch just refactored the codes to provide Java API and add an example Refactor ActorReceiver to support Java
Non-existence - ban decision,Input SELECT FROM jdbcTable WHERE col xxx Current plan Implement JdbcRelation unhandledFilters for removing unnecessary Spark Filter
Structural decision,We should update to the latest version of Zinc in order to match our SBT version Upgrade Zinc from to
Non-existence - ban decision,Remove spark deploy mesos zookeeper dir and use existing configuration spark deploy zookeeper dir for Mesos cluster mode Remove spark deploy mesos zookeeper dir and use spark deploy zookeeper dir
Non-existence - ban decision,Remove spark deploy mesos zookeeper url and use existing configuration spark deploy zookeeper url for Mesos cluster mode Remove spark deploy mesos zookeeper url and use spark deploy zookeeper url
Non-existence - ban decision,Remove spark deploy mesos recoveryMode and use spark deploy recoveryMode configuration for cluster mode Remove spark deploy mesos recoveryMode and use spark deploy recoveryMode
Behavioral decision,We should add SQLUserDefinedType support for encoder Add SQLUserDefinedType support for encoder
Behavioral decision,CSV is the most common data format in the small data world It is often the first format people want to try when they see Spark on a single node Making this built in for the most common source can provide a better experience for first time users We should consider inlining https github com databricks spark csv Have a built in CSV data source implementation
Behavioral decision,Creating an actual logical physical operator for range for matching the performance of RDD Range APIs Compared with the old Range API the new version is times faster than the old version Improve performance of Range APIs via adding logical physical operators
Non-existence - ban decision,As discussed here https github com apache spark pull it might need to implement unhandledFilter to remove duplicated Spark side filtering Implement unhandledFilter interface
Behavioral decision,distinct and unique drop duplicated rows on all columns While dropDuplicates can drop duplicated rows on selected columns Implement dropDuplicates method of DataFrame in SparkR
Behavioral decision,Like shuffle file encryption in SPARK spills data should also be encrypted Support shuffle spill encryption in Spark
Behavioral decision,IsNotNull filter is not being pushed down for JDBC datasource It looks it is SQL standard according to SQL SQL SQL and SQL x and I believe most databases support this isnotnull operator not pushed down for JDBC datasource
Structural decision,Use sqlContext from MLlibTestSparkContext rather than creating new one for spark ml test cases Use sqlContext from MLlibTestSparkContext for spark ml test suites
Non-existence - ban decision,There have been continuing requests e g SPARK for allowing users to extend and modify MLlib models and algorithms If you are a user who needs these changes please comment here about what specifically needs to be modified for your use case Remove final from classes in spark ml trees and ensembles where possible
Behavioral decision, Support UnsafeRow in LocalTableScan
Behavioral decision, Support UnsafeRow in Coalesce Except Intersect
Behavioral decision, Support UnsafeRow in MapPartitions MapGroups CoGroup
Behavioral decision,There are still some SparkPlan does not support UnsafeRow or does not support well Support UnsafeRow in all SparkPlan if possible
Behavioral decision,Similar to Dataset transform DataFrame transform function
Behavioral decision,mutate in the dplyr package supports adding new columns and replacing existing columns But currently the implementation of mutate in SparkR supports adding new columns only Also make the behavior of mutate more consistent with that in dplyr Throw error message when there are duplicated column names in the DataFrame being mutated when there are duplicated column names in specified columns by arguments the last column of the same name takes effect Enhance mutate to support replace existing columns
Behavioral decision, Implement drop method for DataFrame in SparkR
Behavioral decision,Created a new private variable boundTEncoder that can be shared by multiple functions RDD select and collect Replaced all the queryExecution analyzed by the function call logicalPlan A few API comments are using wrong class names e g DataFrame or parameter names e g n A few API descriptions are wrong e g mapPartitions SQL Code refactoring and comment correction in Dataset APIs
Structural decision,Kafka already released and it introduce new consumer API that not compatible with old one So I added new consumer api I made separate classes in package org apache spark streaming kafka v with changed API I didn t remove old classes for more backward compatibility User will not need to change his old spark applications when he uprgade to new Spark version Please rewiew my changes Update KafkaDStreams to new Kafka Consumer API
Behavioral decision,Currently we support read df write df jsonFile parquetFile in SQLContext we should support more external data source API such as read json read parquet read orc read jdbc read csv and so on Some of the exist API is deprecated and will remove at Spark we should also deprecate them at SparkR Note we should refer the DataFrameReader and DataFrameWriter API at Spark SQL but defined with R like style DataFrameReader API http spark apache org docs latest api scala index html org apache spark sql DataFrameReader DataFrameWriter API http spark apache org docs latest api scala index html org apache spark sql DataFrameWriter Support more external data source API in SparkR
Structural decision, Replace shuffleManagerClass with shortShuffleMgrNames in ExternalShuffleBlockResolver
Structural decision, Change numPartitions in RDD to be getNumPartitions to be consistent with pyspark scala
Structural decision,I think that we should upgrade from Tachyon to in order to get the fix for https tachyon atlassian net browse TACHYON Upgrade Tachyon dependency to
Behavioral decision,Add isNaN to Column for SparkR Column should has three related variable functions isNaN isNull isNotNull Replace DataFrame isNaN with DataFrame isnan at SparkR side Because DataFrame isNaN has been deprecated and will be removed at Spark Add isnull to DataFrame for SparkR DataFrame should has two related functions isnan isnull Fix usage of isnan isNaN
Structural decision,Change cumeDist cume dist denseRank dense rank percentRank percent rank rowNumber row number There are two reasons that we should make this change We should follow the naming convention rule of R http www inside r org node Spark DataFrame has deprecated the old convention such as cumeDist and will remove it in Spark It s better to fix this issue before release otherwise we will make breaking API change Rename some window rank function names for SparkR
Behavioral decision,Spark SQL aggregate function stddev stddev pop stddev samp variance var pop var samp skewness kurtosis collect list collect set should support columnName as arguments like other aggregate function max min count sum Stddev Variance etc should support columnName as arguments
Structural decision, unify GetStructField and GetInternalRowField
Behavioral decision,repartition Returns a new Dataset that has exactly numPartitions partitions coalesce Returns a new Dataset that has exactly numPartitions partitions Similar to coalesce defined on an RDD this operation results in a narrow dependency e g if you go from partitions to partitions there will not be a shuffle instead each of the new partitions will claim of the current partitions SQL Support coalesce and repartition in Dataset APIs
Behavioral decision,Implement struct encode decode in SparkR as documented at http spark apache org docs latest api scala index html org apache spark sql functions Implement struct encode decode in SparkR
Behavioral decision,Collection functions documented at http spark apache org docs latest api scala index html org apache spark sql functions are size explode array contains and sort array size explode are already implemented array contains and sort array are to be implemented Implement collection functions in SparkR
Behavioral decision,We want to support JSON serialization of vectors in order to support SPARK JSON serialization of Vectors
Structural decision, consolidate ExpressionEncoder tuple and Encoders tuple
Behavioral decision,RowEncoder doesn t support UserDefinedType now We should add the support for it. Database application is important to focus in this issue Add UserDefinedType support to RowEncoder
Behavioral decision,Random Forests have feature importance but GBT do not It would be great if we can add feature importance to GBT as well Perhaps the code in Random Forests can be refactored to apply to both types of ensembles See https issues apache org jira browse SPARK Feature Importance for GBT
Behavioral decision, Add Java API for trackStateByKey
Behavioral decision,If it returns Text we can reuse this in Spark SQL to provide a WholeTextFile data source and directly convert the Text into UTF String without extra string decoding and encoding WholeTextFileRDD should return Text rather than String
Non-existence - ban decision, Remove OpenHashSet for the old aggregate
Non-existence - ban decision,We don t sufficiently test the path work well Remove the option to turn off unsafe and codegen
Behavioral decision,Implement Python API for bisecting k means Python API for bisecting k means
Behavioral decision,We deprecated runs in Spark SPARK In we can either remove runs or make it no effect with warning messages So we can simplify the implementation I prefer the latter for better binary compatibility Make runs no effect in k means
Non-existence - ban decision, Remove the internal implicit conversion from Expression to Column in functions scala
Non-existence - ban decision, Remove implicit conversion from Expression to Column
Non-existence - ban decision,DataFrame has an internal implicit conversion that turns a LogicalPlan into a DataFrame This has been fairly confusing to a few new contributors Since it doesn t buy us much we should just remove that implicit conversion Remove the internal implicit conversion from LogicalPlan to DataFrame
Behavioral decision,Umbrella ticket to walk through all newly introduced APIs to make sure they are consistent SQL API audit for Spark
Non-existence - ban decision,Since we have bytes as number of records in the beginning of a page then the address can not be zero so we do not need the bitset Remove Bitset in BytesToBytesMap
Non-existence - ban decision,We should remove methods for variance stddev skewness GroupedData should only keep common first order statistics
Structural decision,These two classes should be public since they are used in public code Make DataFrameHolder and DatasetHolder public
Behavioral decision, Add R API for stddev variance
Behavioral decision,Add Java friendly API for StreamingListener Add JavaStreamingListener
Non-existence - ban decision,Since SPARK is resolved MapPartitionWithPrepare is not needed anymore Remove PrepareRDD
Behavioral decision,DISTRIBUTE BY allows the user to control the partitioning and ordering of a data set which can be very useful for some applications Add a DataFrame API that provides functionality similar to HiveQL s DISTRIBUTE BY
Behavioral decision,In order to lay the groundwork for proper off heap memory support in SQL Tungsten we need to extend our MemoryManager to perform bookkeeping for off heap memory Add support for off heap memory to MemoryManager
Behavioral decision,We use scala collection mutable BitSet in BroadcastNestedLoopJoin now We should use Spark s BitSet Use Spark BitSet in BroadcastNestedLoopJoin
Structural decision,runs introduces extra complexity and overhead in MLlib s k means implementation I haven t seen much usage with runs not equal to We can deprecate this method in and remove or void it in It helps us simplify the implementation Deprecate runs in k means
Behavioral decision,Currently the Write Ahead Log in Spark Streaming flushes data as writes need to be made S does not support flushing of data data is written once the stream is actually closed In case of failure the data for the last minute default rolling interval will not be properly written Therefore we need a flag to close the stream after the write so that we achieve read after write consistency Flag to close Write Ahead Log after writing
Behavioral decision,We should add text to DataFrameReader and DataFrameWriter Python API for text data source
Behavioral decision,This is the first cut implementation of trackStateByKey new improvement state management method in Spark Streaming See the epic jira for more details https issues apache org jira browse SPARK Implement trackStateByKey for improved state management
Structural decision, Mark all Stage ResultStage ShuffleMapStage internal state as private
Structural decision,Update the tachyon client dependency from to There are no new dependencies added or Spark facing APIs changed Upgrade Tachyon dependency to
Behavioral decision,As part of the work to implement SPARK it would be nice to have the network library efficiently stream data over a connection Currently all it has is the shuffle data protocol which is not very efficient for large files it requires the whole file to be buffered on the receiver side before the receiver can do anything For large files that comes at a huge cost in memory You can chunk large files but that requires the client to ask for each chunk separately Instead a similar approach but allowing the data to be processed as it arrives would be a lot more efficient and make it easier to implement the file server in the referenced bug Support streaming data using network library
Structural decision,Right now we stack a new URLClassLoader when a user add a jar through SQL s add jar command This approach can introduce issues caused by the ordering of added jars when a class of a jar depends on another class of another jar For example In this case when we lookup class B we will not be able to find class A because Jar is the parent of Jar Use a single URLClassLoader for jars added through SQL s ADD JAR command
Structural decision,We use KCL in the current master KCL added integration with Kinesis Producer Library KPL and support auto de aggregation It would be great to upgrade KCL to the latest stable version Note that the latest version is and restored compatibility with dynamodb streams kinesis adapter which was broken in See https github com awslabs amazon kinesis client release notes tdas brkyvz Please recommend a version for upgrade Upgrade Kinesis Client Library to the latest stable version
Behavioral decision,Also SQLContext newSession Add getOrCreate for SparkContext SQLContext for Python
Non-existence - ban decision,For a variety of reasons we tagged a bunch of internal classes in the execution package in SQL as DeveloperApi Remove DeveloperApi annotation from private classes
Non-existence - ban decision,In the spirit of SPARK we should clean up the use of SPARK HOME and if possible remove it entirely We need to look through what this is used for One use was allowing applications to run different versions of Spark in standalone mode For instance someone could submit an application with a custom SPARK HOME and the Worker would launch an Executor using a different path for Spark This use case is not widely used and maybe should just be removed The existing constructors that take SPARK HOME for this purpose should be deprecated and we should explain that SPARK HOME is no longer used for this purpose If there are other legitimate reasons for SPARK HOME we can keep it around we need to audit the uses of it Clean up and clarify use of SPARK HOME
