Structural decision, We should deprecate ConnectionManager in before removing it in Deprecate NIO ConnectionManager
Structural decision,What StringIndexerInverse does is not strictly associated with StringIndexer and the name is not super clear Rename StringIndexerInverse to IndexToString
Non-existence - ban decision,This requires some discussion I m not sure whether runs is a useful parameter It certainly complicates the implementation We might want to optimize the k means implementation with block matrix operations In this case having runs may not be worth the trade offs Remove runs from KMeans under the pipeline API
Behavioral decision,There exists a chance that the prefixes keep growing to the maximum pattern length Then the final local processing step becomes unnecessary Skip local processing in PrefixSpan if there are no small prefixes
Structural decision,parquet mr fixed several issues that affect Spark For example PARQUET SPARK Upgrade parquet mr to
Structural decision,The utilities such as Substring substringBinarySQL and BinaryPrefixComparator computePrefix for binary data are put together in ByteArray for easy to read Move utilities for binary data into ByteArray
Structural decision,PlatformDependent UNSAFE is way too verbose Rename PlatformDependent UNSAFE Platform
Non-existence - ban decision,I took a look at the commit messages in git log it looks like the individual commit messages are not that useful to include but do make the commit messages more verbose They are usually just a bunch of extremely concise descriptions of bug fixes merges etc See mailing list discussions http apache spark developers list n nabble com discuss Removing individual commit messages from the squash commit message td html Remove individual commit messages from the squash commit message
Behavioral decision,Add Python API user guide and example for ml regression IsotonicRegression Add Python API for ml regression IsotonicRegression
Behavioral decision,Add Python API for MultilayerPerceptronClassifier Add Python API for MultilayerPerceptronClassifier
Behavioral decision,Add Python API user guide and example for ml feature CountVectorizerModel Add Python API for ml feature CountVectorizer
Non-existence - ban decision,We introduced the Netty network module for shuffle in Spark and has turned it on by default for releases The old ConnectionManager is difficult to maintain It s time to remove it Remove ConnectionManager
Behavioral decision,see discussion here https github com apache spark pull issuecomment Improve performance of Decimal times and casting from integral
Non-existence - ban decision,TypeCheck no longer applies in the new Tungsten world Remove TypeCheck in debug package
Non-existence - ban decision,In https github com apache spark pull we added FromUnsafe to convert nexted unsafe data like array map struct to safe versions It s a quick solution and we already have GenerateSafe to do the conversion which is codegened So we should remove FromUnsafe and implement its codegen version in GenerateSafe remove FromUnsafe and add its codegen version to GenerateSafe
Behavioral decision,JoinedRow anyNull currently loops through every field to check for null which is inefficient if the underlying rows are UnsafeRows It should just delegate to the underlying implementation JoinedRow anyNull should delegate to the underlying rows
Behavioral decision,This JIRA is for making several ML APIs public to make it easier for users to write their own Pipeline stages Issue brought up by eronwright Descriptions below copied from http apache spark developers list n nabble com Make ML Developer APIs public post td html We plan to make these APIs public in Spark However they will be marked DeveloperApi and are very likely to be broken in the future VectorUDT To define a relation with a vector field VectorUDT must be instantiated Identifiable trait The trait generates a unique identifier for the associated pipeline component Nice to have a consistent format by reusing the trait ProbabilisticClassifier Third party components should leverage the complex logic around computing only selected columns We will not yet make these public SchemaUtils Third party pipeline components have a need for checking column types and appending columns This will probably be moved into Spark SQL Users can copy the methods into their own as needed Make some ML APIs public VectorUDT Identifiable ProbabilisticClassifier
Behavioral decision,Consider SortMergeJoin which requires a sorted clustered distribution of its input rows Say that both of SMJ s children produce unsorted output but are both single partition In this case we will need to inject sort operators but should not need to inject exchanges Unfortunately it looks like the Exchange unnecessarily repartitions using a hash partitioning We should update Exchange so that it does not unnecessarily repartition children when only the ordering requirements are unsatisfied I d like to fix this for Spark since it makes certain types of unit tests easier to write EnsureRequirements should not add unnecessary shuffles when only ordering requirements are unsatisfied
Structural decision,Previously we use MB as the default page size which was way too big for a lot of Spark applications especially for single node This patch changes it so that the default page size if unset by the user is determined by the number of cores available and the total execution memory available Pick default page size more intelligently
Behavioral decision,Add feature interaction as a transformer which takes a list of vector double columns and generate a single vector column that contains the interactions multiplication among them with proper handling of feature names Add feature interaction as a transformer
Behavioral decision,E g currently we can do up to sorts within a task During the aggregation During a sort on the same key During the shuffle In environments with tight memory restrictions the first operator may acquire so much memory such that the subsequent ones in the same task are starved A simple fix is to reserve at least a page in advance in each of these places The reserved page size need not be the same as the normal page size This is a sister problem to SPARK in Spark Core Reserve a page in all unsafe operators to avoid starving an operator
Non-existence - ban decision,A small performance optimization we don t need to generate a Tuple and then immediately discard the key We also don t need an extra wrapper Remove SqlNewHadoopRDD s generated Tuple and InterruptibleIterator
Non-existence - ban decision,It is subsumed by the new aggregate implementation Remove GeneratedAggregate
Non-existence - ban decision,GenerateUnsafeProjection can be used directly as a code generated serializer We no longer need SparkSqlSerializer Remove SparkSqlSerializer in favor of Unsafe exchange
Behavioral decision,Currently we don t support using DecimalType with precision in new unsafe aggregation it s good to support it Support update DecimalType with precision in UnsafeRow
Behavioral decision,In many modeling application data points are not necessarily sampled with equal probabilities Linear regression should support weighting which account the over or under sampling LinearRegression should supported weighted data
Behavioral decision, update InternalRow toSeq to make it accept data type info
Non-existence - ban decision,Spark s style checker should ban the use of Scala s JavaConversions which provides implicit conversions between Java and Scala collections types Instead we should be performing these conversions explicitly using JavaConverters or forgoing the conversions altogether if they re occurring inside of performance critical code Ban use of JavaConversions and migrate all existing uses to JavaConverters
Behavioral decision, Add StreamingContext getActiveOrCreate to python API
Structural decision,See http apache spark developers list n nabble com Re Should spark ec get its own repo td html for more details Move spark ec from mesos to amplab
Non-existence - ban decision, remove the createCode and createStructCode and replace the usage of them by createStructCode
Non-existence - ban decision,While reviewing yhuai s patch for SPARK I noticed that Exchange s compatible check may be incorrectly returning false in many cases As far as I know this is not actually a problem because the compatible meetsRequirements and needsAnySort checks are serving only as short circuit performance optimizations that are not necessary for correctness In order to reduce code complexity I think that we should remove these checks and unconditionally rewrite the operator s children This should be safe because we rewrite the tree in a single bottom up pass Remove compatibleWith meetsRequirements and needsAnySort checks from Exchange
Non-existence - ban decision,They were added to improve performance so JIT can inline the JoinedRow calls However we can also just improve it by projecting output out to UnsafeRow in Tungsten variant of the operators Remove all extra JoinedRows
Non-existence - ban decision, Remove UnsafeRowConverter in favor of UnsafeProjection
Structural decision,We should consolidate LocalScheduler and ClusterScheduler given most of the functionalities are duplicated in both This can be done by removing the LocalScheduler and create a LocalSchedulerBackend that connects directly to an Executor Consolidate local scheduler and cluster scheduler
Non-existence - ban decision,It is a big change but it lets us use the type information to prevent accidentally passing internal types to external types Remove InternalRow s inheritance from Row
Non-existence - ban decision,See SPARK We added varargs again Though it is technically correct it often requires that developers do clean assembly rather than not clean assembly which is a nuisance during development This JIRA will remove it for now pending a fix to the Scala compiler Params setDefault should not keep varargs annotation
Non-existence - ban decision,Spark has an option called spark localExecution enabled according to the docs quote Enables Spark to run certain jobs such as first or take on the driver without sending tasks to the cluster This can make certain jobs execute very quickly but may require shipping a whole partition of data to the driver quote This feature ends up adding quite a bit of complexity to DAGScheduler especially in the runLocallyWithinThread method but as far as I know nobody uses this feature I searched the mailing list and haven t seen any recent mentions of the configuration nor stacktraces including the runLocally method As a step towards scheduler complexity reduction I propose that we remove this feature and all code related to it for Spark Remove DAGScheduler runLocallyWithinThread and spark localExecution enabled
Non-existence - ban decision,A small change based on code review and offline discussion with dragos Removing unnecessary self types in Catalyst
Non-existence - ban decision,As the new Parquet external data source matures we should remove the old Parquet support now Removes old Parquet support code
Non-existence - ban decision,They are not very useful and cause problems with toString due to the order they are mixed in Remove LeafNode UnaryNode BinaryNode from TreeNode
Non-existence - ban decision,The SparkContext constructor that takes preferredNodeLocalityData has not worked since before Spark Also the feature in SPARK is strictly better than a correct implementation of that feature We should remove any documentation references to that feature and print a warning when it is used saying it doesn t work Remove references to preferredNodeLocalityData in javadoc and print warning when used
Non-existence - ban decision,It is unnecessary and makes the type hierarchy slightly more complicated than needed Remove ExtractValueWithOrdinal abstract class
Non-existence - ban decision,Right now InternalRow is megamorphic because it has many different implementations We should work towards having only one or at most two InternalRow implementations Remove EmptyRow class
Non-existence - ban decision,The type alias was there because initially when I moved Row around I didn t want to do massive changes to the expression code But now it should be pretty easy to just remove it One less concept to worry about Remove InternalRow type alias in expressions package
Non-existence - ban decision,Based on discussion offline with marmbrus we should remove GenerateProjection Remove GenerateProjection
Structural decision,This will make it convenient for R users to use SparkR from their browsers Install and configure RStudio server on Spark EC
Non-existence - ban decision,We should remove the existing ExpressionOptimizationSuite and update checkEvaluation to also run the optimizer version ExpressionEvalHelper checkEvaluation should also run the optimizer version
Non-existence - ban decision,From my perspective as a code reviewer I find them more confusing than using String directly Remove Term Code type aliases in code generation
Non-existence - ban decision,It s not a very useful type to use We can just remove it to simplify expressions slightly Remove EvaluatedType from SQL Expression
Structural decision,ExternalSorter contains a bunch of to move this functionality out of ExternalSorter and into a separate class which shares a common interface insertAll writePartitionedFile This is a stepping stone towards eventually removing this bypass path see SPARK Move hash style shuffle code out of ExternalSorter and into own file
Non-existence - ban decision,Learnt a lesson from SPARK Spark should avoid to use scala concurrent ExecutionContext Implicits global because the user may submit blocking actions to scala concurrent ExecutionContext Implicits global and exhaust all threads in it This could crash Spark So Spark should always use its own thread pools for safety Remove import scala concurrent ExecutionContext Implicits global
Non-existence - ban decision, Removed calling size length in while condition to avoid extra JVM call
Non-existence - ban decision,We can just rewrite distinct using groupby i e aggregate operator Remove physical Distinct operator in favor of Aggregate
Non-existence - ban decision, Removed diffSum which is theoretical zero in LinearRegression and coding formating
Structural decision,We want to change and improve the spark ml API for trees and ensembles but we cannot change the old API in spark mllib To support the changes we want to make we should move the implementation from spark mllib to spark ml We will generalize and modify it but will also ensure that we do not change the behavior of the old API There are several steps to this Copy the implementation over to spark ml and change the spark ml classes to use that implementation rather than calling the spark mllib implementation The current spark ml tests will ensure that the implementations learn exactly the same models Note This should include performance testing to make sure the updated code does not have any regressions UPDATE I have run tests using spark perf and there were no regressions Remove the spark mllib implementation and make the spark mllib APIs wrappers around the spark ml implementation The spark ml tests will again ensure that we do not change any behavior Move the unit tests to spark ml and change the spark mllib unit tests to verify model equivalence This JIRA is now for step only Steps and will be in separate JIRAs After these updates we can more safely generalize and improve the spark ml implementation Move tree forest implementation from spark mllib to spark ml
Non-existence - ban decision,This maven repository is blocked in China We should get rid of that dependency so people in China can compile Spark Remove dependency on Twitter J repository
Behavioral decision,This is not always possible but whenever possible we should remove or reduce the differences between Pandas and Spark DataFrames in Python Improve DataFrame API compatibility with Pandas
Behavioral decision,This depends on some internal interface of Spark SQL should be done after merging into Spark DataFrame UDFs in R
Behavioral decision,Would be great to create APIs for external block stores rather than doing a bunch of if statements everywhere Create external block store API
Structural decision, Upgrade Tachyon dependency to
Structural decision,Deprecated configs are currently all strewn across the code base It would be good to simplify the handling of the deprecated configs in a central location to avoid duplicating the deprecation logic everywhere Centralize deprecated configs in SparkConf
Non-existence - ban decision,Continue the discussion from the LDA PR CheckpoingDir is a global Spark configuration which should not be altered by an ML algorithm We could check whether checkpointDir is set if checkpointInterval is positive Remove setCheckpointDir from LDA and tree Strategy
Non-existence - ban decision,This method survived the code review and it has been there since v It exposes jblas types Let s remove it from the public API I expect that no one calls it directly Hide ALS solveLeastSquares
Behavioral decision,toLocalIterator is available in Java and Scala If we add this functionality to Python then we can also be able to use PySpark to iterate over a dataset partition by partition Add toLocalIterator to pyspark rdd
Structural decision,Fix a todo in spark sql remove Command and use RunnableCommand instead Refactory command in spark sql
Non-existence - ban decision, Remove unneeded staging repositories from build
Structural decision,mqtt client was removed from the Eclipse Paho repository and hence is breaking Spark build Upgrade MQTT dependency to use mqtt client
Structural decision,In this refactoring the performance is slightly increased by removing the overhead from breeze vector The bottleneck is still in breeze norm which is implemented by activeIterator This inefficiency of breeze norm will be addressed in next PR At least this PR makes the base Refactorize Normalizer to make code cleaner
Non-existence - ban decision,In RDDSampler it try use numpy to gain better performance for possion but the number of call of random is only faction N in the pure python implementation of possion so there is no much performance gain from numpy numpy is not a dependent of pyspark so it maybe introduce some problem such as there is no numpy installed in slaves but only installed master as reported in xxxx It also complicate the code a lot so we may should remove numpy from RDDSampler remove numpy from RDDSampler of PySpark
Non-existence - ban decision,For example YarnRMClient and YarnRMClientImpl can be merged YarnAllocator and YarnAllocationHandler can be merged Remove layers of abstraction in YARN code no longer needed after dropping yarn alpha
Non-existence - ban decision,Due to vertex attribute caching EdgeRDD previously took two type parameters ED and VD However this is an implementation detail that should not be exposed in the interface so this PR drops the VD type parameter This requires removing the filter method from the EdgeRDD interface because it depends on vertex attribute caching Drop VD type parameter from EdgeRDD
Structural decision,We should upgrade snappy java to across all of our maintenance branches This release improves error messages when attempting to deserialize empty inputs using SnappyInputStream this operation is always an error but the old error messages made it hard to distinguish failures due to empty streams from ones due to reading invalid corrupted streams see https github com xerial snappy java issues for more context This should be a major help in the Snappy debugging work that I ve been doing Upgrade snappy java to
Non-existence - ban decision,After Pyrolite release a new version with PR https github com irmen Pyrolite pull we should remove the workaround introduced in PR https github com apache spark pull remove workaround to pickle array of float for Pyrolite
Non-existence - ban decision,This will depend a bit on both user demand and the commitment level of maintainers but I d like to propose the following timeline for yarn alpha support Spark Deprecate YARN alpha Spark Remove YARN alpha i e require YARN stable Since YARN alpha is clearly identified as an alpha API it seems reasonable to drop support for it in a minor release However it does depend a bit whether anyone uses this outside of Yahoo and that I m not sure of In the past this API has been used and maintained by Yahoo but they ll be migrating soon to the stable API s Deprecate and later remove YARN alpha support
Non-existence - ban decision,HiveLocalContext is nearly completely redundant with HiveContext We should consider deprecating it and removing all uses Get rid of LocalHiveContext
Non-existence - ban decision,According to http doc akka io docs akka intro getting started html Akka is now published to Maven Central so our documentation and POM files don t need to use the old Akka repo It will be one less step for users to worry about Remove use of special Maven repo for Akka
Non-existence - ban decision,The removed codes are not reachable because InConversion already resolve the type coercion issues Remove IN type coercion from PromoteStrings
Non-existence - ban decision,There is a metadata introduced before to mark the optional columns in merged Parquet schema for filter predicate pushdown As we upgrade to Parquet which includes the fix for the pushdown of optional columns we don t need this metadata now Remove the metadata used to mark optional columns in merged Parquet schema for filter predicate pushdown
Structural decision,Apache Parquet is released officially last week on Jan This issue aims to bump Parquet version to since it includes many fixes https lists apache org thread html af c f a d ec b bbeecaea aa ef f c Cdev parquet apache org E Upgrade Parquet to
Behavioral decision,Create a Python wrapper for spark ml classification LinearSVC LinearSVC Python API
Behavioral decision,To implement DDL commands we added several analyzer rules in sql hive module to analyze DDL related plans However our Analyzer currently only have one extending interface extendedResolutionRules which defines extra rules that will be run together with other rules in the resolution batch and doesn t fit DDL rules well because DDL rules may do some checking and normalization but we may do it many times as the resolution batch will run rules again and again until fixed point and it s hard to tell if a DDL rule has already done its checking and normalization It s fine because DDL rules are idempotent but it s bad for analysis performance some DDL rules may depend on others and it s pretty hard to write if conditions to guarantee the dependencies It will be good if we have a batch which run rules in one pass so that we can guarantee the dependencies by rules order add a new extending interface in Analyzer for post hoc resolution
Behavioral decision,When we use the jdbc in pyspark if we check the lowerBound and upperBound we can give a more friendly suggestion Check the lowerBound and upperBound whether equal None in jdbc API
Behavioral decision,Currently in SQL we implement overwrites by calling fs delete directly on the original data This is not ideal since we the original files end up deleted even if the job aborts We should extend the commit protocol to allow file overwrites to be managed as well Add deleteWithJob hook to internal commit protocol API
Behavioral decision,In SPARK support for AES encryption was added to the Spark network library But the authentication of different Spark processes is still performed using SASL s DIGEST MD mechanism That means the authentication part is the weakest link since the AES keys are currently encrypted using des strongest cipher supported by SASL Spark can t really claim to provide the full benefits of using AES for encryption We should add a new auth protocol that doesn t need these disclaimers AES based authentication mechanism for Spark
Non-existence - ban decision, remove the supportsPartial flag in AggregateFunction
Non-existence - ban decision,Remove useless databaseName from SimpleCatalogRelation Remove databaseName from SimpleCatalogRelation
Structural decision,Since spark sql hive thriftServer singleSession is a configuration of SQL component this conf can be moved from SparkConf to StaticSQLConf When we introduced spark sql hive thriftServer singleSession all the SQL configuration can be modified in different sessions Later static SQL configuration is added It is a perfect fit for spark sql hive thriftServer singleSession Previously we did the same move for spark sql warehouse dir from SparkConf to StaticSQLConf Move spark sql hive thriftServer singleSession to SQLConf
Structural decision,Right now ContextCleaner referenceBuffer is ConcurrentLinkedQueue and the time complexity of the remove action is O n It can be changed to use ConcurrentHashMap whose remove is O Change ContextCleaner referenceBuffer to ConcurrentHashMap to make it faster
Non-existence - ban decision,SortPartitions and RedistributeData logical operators are not actually used and can be removed Note that we do have a Sort operator with global flag false that subsumed SortPartitions Remove SortPartitions and RedistributeData
Structural decision,I recently hit a bug of com thoughtworks paranamer paranamer which causes jackson fail to handle byte array defined in a case class Then I find https github com FasterXML jackson module scala issues which suggests that it is caused by a bug in paranamer Let s upgrade paranamer Since we are using jackson and jackson module paranamer use com thoughtworks paranamer paranamer I suggests that we upgrade paranamer to Upgrade com thoughtworks paranamer paranamer to
