Yes,The current InternalRow hierarchy makes a difference between immutable and mutable rows In practice we cannot guarantee that an immutable internal row is immutable you can always pass a mutable object as an one of its elements Lets make all internal rows mutable and reduce the complexity Simplify InternalRow hierarchy
No,I somehow saw a failed test org apache spark DistributedSuite caching in memory serialized replicated Its log shows that Spark master asked the worker to launch an executor before the worker actually got the response of registration So the master knew that the worker had been registered But the worker did not know if it self had been registered Then seems the worker did not launch any executor Master may ask a worker to launch an executor before the worker actually got the response of registration
No,Run the following r SPARK HOME sessionInfo R version Patched r Platform x apple darwin bit Running under macOS Sierra Spark returns incorrect result when collect ing a cached Dataset with many columns
Yes,Dataset always does eager analysis now Thus spark sql eagerAnalysis is not used any more Thus we need to remove it Remove spark sql eagerAnalysis
No,Given table create table dates ts timestamp the following view creation SQL failes with Failed to analyze the canonicalized SQL It is possible there is a bug in Spark create view test dates as select ts interval day from dates Cannot create view which includes interval arithmetic
No,The following complicated example becomes stuck in the InferFiltersFromConstraints rule and never runs However it doesn t fail with a stack overflow and doesn t hit the limit on optimization passes so I think there s some sort of non obvious infinite loop within the rule itself I attached YourKit to my Spark process and recorded some stack traces See the attached screenshots showing the distribution of time for the hung query InferFiltersFromConstraints rule never terminates for query
No,There is a bug in how a transposed SparseMatrix isTransposed true does multiplication with a SparseVector The bug is present for v in both org apache spark mllib linalg BLAS mllib and org apache spark ml linalg BLAS mllib local in the private gemv method with signature bq gemv alpha Double A SparseMatrix x SparseVector beta Double y DenseVector This bug can be verified by running the following snippet in a Spark shell here using v Erroneous computation in multiplication of transposed SparseMatrix with SparseVector
No,The master Maven build is currently broken because ReplSuite consistently fails with ClassCircularityErrors See https spark tests appspot com jobs spark master test maven hadoop for a timeline of the failure Here s the first build where this failed https amplab cs berkeley edu jenkins job spark master test maven hadoop This appears to correspond to https github com apache spark commit a c d b eb e ed b dd cd d bba d The same tests pass in the SBT build ReplSuite fails with ClassCircularityError in master Maven builds
No,Here are re production steps create any scala spark application which will work long enough to open the application details in Web UI run spark submit command for standalone cluster like master spark localhost open running application details in Web UI like localhost spark submit will never finish you will have to kill the process Cause The application creates a thread with infinite loop for web UI communication and never stops it The application is waiting for the thread to be finished instead even if you close the web page Web UI prevents spark submit application to be finished
No,Code generation including too many mutable states exceeds JVM size limit to extract values from references into fields in the constructor We should split the generated extractions in the constructor into smaller functions Code generation including too many mutable states exceeds JVM size limit
No, Fixed Insert Failure To Data Source Tables when the Schema has the Comment Field
No,Spark Scala repl doesn t honor spark replClassServer port configuration so user cannot set a fixed port number through spark replClassServer port There s no issue in Spark since this class is removed Spark Scala repl doesn t honor spark replClassServer port
No,https datastax oss atlassian net browse SPARKC Was brought to my attention where the following Which leads me to believe there is something wrong with the reused exchange Reused Exchange Aggregations Produce Incorrect Results
No,When there are K application history in the history server back end it can take a very long time to even get a single application history page After some investigation I found the root cause was the following piece of transforms the map to an iterator and then uses the find api which is O n instead of O from a map get operation Spark history server web Ui takes too long for a single application
No,I m experiensing problems with s a and working with parquet with dataset api the symptom of problem tasks failing with so when program runs you can jps for pid and do lsof p grep https and you ll see constant grow of CLOSE WAITs Our way to bypass problem is to use count In addition we ve seen that df dropDuplicates a b rdd isEmpty doesn t produce problem too take or isEmpty on dataset leaks s a connections
Yes,There are listLeafFiles related functions in Spark ListingFileCatalog listLeafFiles which calls HadoopFsRelation listLeafFilesInParallel if the number of paths passed in is greater than a threshold if it is lower then it has its own serial version implemented HadoopFsRelation listLeafFiles called only by HadoopFsRelation listLeafFilesInParallel HadoopFsRelation listLeafFilesInParallel called only by ListingFileCatalog listLeafFiles It is actually very confusing and error prone because there are effectively two distinct implementations for the serial version of listing leaf files This into ListingFileCatalog since it is the only class that needs this Keep only one function for listing files in serial Consolidate various listLeafFiles implementations
Yes,Query Only one distinct should be necessary This makes a bunch of unions slower than a bunch of union alls followed by a distinct Optimizer should remove unnecessary distincts in multiple unions
No,Using a malformed URL in sc addJar or sc addFile bricks the executors forever The executors try to update their dependencies but because the URL is malformed they always throw a malformedURL exception Then your cluster is unusable until you restart it Adding a malformed URL to sc addJar and or sc addFile bricks Executors
No,there is a race condition when FetchFailed and resubmit failed stage job job run in different threads if job failed times due to fetchfailed and aborted then job can not post ResubmitFailedStages becase the failedStages in DAGScheduler is not empty now The failed stage never resubmitted due to abort stage in another thread
No,We were getting incorrect results from the DataFrame except method all rows were being returned instead of the ones that intersected Calling subtract on the underlying RDD returned the correct result We tracked it down to the use of coalesce the following is the simplest example case we created that reproduces the issue We should get the same result from both uses of except but the one using coalesce returns instead of Dataframe except returns incorrect results when combined with coalesce
No,h Problem Remainder expression returns incorrect result when using expression eval to calculate the result expression eval is called in case like constant folding Remainder expression eval returns incorrect result
No,The FileStreamSource used by StructuredStreaming first resolves globs and then creates a ListingFileCatalog which listFiles with the resolved glob patterns If a folder is deleted after glob resolution but before the ListingFileCatalog can list the files we can run into a FileNotFoundException This should not be a fatal exception for a streaming job However we should include a warn message Folder deletion after globbing may fail StructuredStreaming jobs
No,AssertOnQuery has two apply constructor one that accepts a closure that returns boolean and another that accepts a closure that returns Unit This is actually very confusing because developers could mistakenly think that AssertOnQuery always require a boolean return type and verifies the return result when indeed the value of the last statement is ignored in one of the constructors AssertOnQuery condition should be consistent in requiring Boolean return type
No,When parsing a CSV with a date time column that contains a variant ISO that doesn t include a colon in the offset casting to Timestamp fails Here s a simple example CSV content quote time T T T quote Here s the stack trace that results from processing this data quote ERROR Utils Aborting task java lang IllegalArgumentException T at org apache xerces jaxp datatype XMLGregorianCalendarImpl Parser skip Unknown Source at org apache xerces jaxp datatype XMLGregorianCalendarImpl Parser parse Unknown Source at org apache xerces jaxp datatype XMLGregorianCalendarImpl Unknown Source at org apache xerces jaxp datatype DatatypeFactoryImpl newXMLGregorianCalendar Unknown Source at javax xml bind DatatypeConverterImpl parseDateTime DatatypeConverterImpl java at javax xml bind DatatypeConverterImpl parseDateTime DatatypeConverterImpl java at javax xml bind DatatypeConverter parseDateTime DatatypeConverter java at org apache spark sql catalyst util DateTimeUtils stringToTime DateTimeUtils scala at org apache spark sql execution datasources csv CSVTypeCast castTo CSVInferSchema scala quote Somewhat related I believe Python standard libraries can produce this form of zone offset The system I got the data from is written in Python https docs python org library datetime html strftime strptime behavior Spark SQL Catalyst doesn t handle ISO date without colon in offset
No, fix some DDL bugs about table management when same name temp view exists
No,In PySpark df take ends up running a single stage job which computes only one partition of df while df limit collect ends up computing all partitions of df and runs a two stage job This difference in performance is confusing so I think that we should generalize the fix from SPARK so that Dataset collect can be implemented efficiently in Python df take and df limit collect perform differently in Python
No,When I run a python application and specify a remote path for the extra files to be included in the PYTHON PATH using the py files or spark submit pyFiles configuration option in YARN Cluster mode I get the following error Exception in thread main java lang IllegalArgumentException Launching Python applications through spark submit is currently only supported for local files s xxxx app py at org apache spark deploy PythonRunner formatPath PythonRunner scala at org apache spark deploy PythonRunner anonfun formatPaths apply PythonRunner scala at org apache spark deploy PythonRunner anonfun formatPaths apply PythonRunner scala at scala collection TraversableLike anonfun map apply TraversableLike scala at scala collection TraversableLike anonfun map apply TraversableLike scala at scala collection IndexedSeqOptimized class foreach IndexedSeqOptimized scala at scala collection mutable ArrayOps ofRef foreach ArrayOps scala at scala collection TraversableLike class map TraversableLike scala at scala collection mutable ArrayOps ofRef map ArrayOps scala at org apache spark deploy PythonRunner formatPaths PythonRunner scala at org apache spark deploy SparkSubmit anonfun prepareSubmitEnvironment apply SparkSubmit scala at org apache spark deploy SparkSubmit anonfun prepareSubmitEnvironment apply SparkSubmit scala at scala Option foreach Option scala at org apache spark deploy SparkSubmit prepareSubmitEnvironment SparkSubmit scala at org apache spark deploy SparkSubmit submit SparkSubmit scala at org apache spark deploy SparkSubmit main SparkSubmit scala at org apache spark deploy SparkSubmit main SparkSubmit scala Here are sample commands which would throw this error in Spark sparkApp py requires app py spark submit deploy mode cluster py files s xxxx app py s xxxx sparkApp py works fine in spark submit deploy mode cluster conf spark submit pyFiles s xxxx app py s xxxx sparkApp py not working in This would work fine if app py is downloaded locally and specified This was working correctly using py files option in earlier version of Spark but not using the spark submit pyFiles configuration option But now it does not work through either of the ways The following diff shows the comment which states that it should work with non local paths for the YARN cluster mode and we are specifically doing separate validation to fail if YARN client mode is used with remote paths https github com apache spark blob master core src main scala org apache spark deploy SparkSubmit scala L And then this was newly added in which now stores it and hence this validation gets triggered even if we specify files through py files option https github com apache spark blob master core src main scala org apache spark deploy SparkSubmit scala L Also we changed the logic in YARN client to read values directly from spark submit pyFiles configuration instead of from py files earlier https github com apache spark commit ba b f fee c e ea bd f a a e diff b df f b d e b R So now its broken whether we use py files or spark submit pyFiles as the validation gets triggered in both cases irrespective of whether we use Client or Cluster mode with YARN Specifying remote files for Python based Spark jobs in Yarn cluster mode not working
No,While trying to reach launch multiple containers in pool if running executors count reaches or goes beyond the target running executors the container is released and marked failed This can cause many jobs to be marked failed causing overall job failure I will have a patch up soon after completing testing panel title Typical Exception found in Driver marking the container to Failed panel Dynamic allocation race condition Containers getting marked failed while releasing
Yes,We use multiple DStreams coming from different Kafka topics in a Streaming application Some settings like maxrate and backpressure enabled disabled would be better passed as config to KafkaUtils createStream and KafkaUtils createDirectStream instead of setting them in SparkConf Being able to set a different maxrate for different streams is an important requirement for us we currently work around the problem by using one receiver based stream and one direct stream We would like to be able to turn on backpressure for only one of the streams as well Set Streaming MaxRate Independently For Multiple Streams
Yes,Profiling a job we saw that patten matching in wrap function of HiveInspector is consuming around of the time which can be avoided A similar change in the unwrap function was made in SPARK When wrapping catalyst datatype to Hive data type avoid pattern matching
No,h Problem description The following query triggers out of memory error will not collect the GB unrolled until all GB input data has been processed Memory leak in Memory store when unable to cache the whole RDD in memory
No,When the permanent tables views do not exist but the temporary view exists the expected error should be NoSuchTableException for partition related ALTER TABLE commands However it always reports a confusing error message For example Multiple Bugs in DDL Statements on Temporary Views
No,several default params in sparkR spark mlp is wrong layers should be null tol should be e stepSize should be seed should be make the default params in sparkR spark mlp consistent with MultilayerPerceptronClassifier
No,If you create tables as follows create table a as select A as str cast as decimal as num create table b as select A as str Then select floor num from a returns but select floor num from a join b on a str b str returns Floor ceil of decimal returns wrong result if it s in compact format
No,For data sources without extending SchemaRelationProvider we expect users to not specify schemas when they creating tables If the schema is input from users an exception is issued Since Spark for any data source to avoid infer the schema every time we store the schema in the metastore catalog Thus when reading a cataloged data source table the schema could be read from metastore catalog In this case we also got an exception For example Reading Cataloged Data Sources without Extending SchemaRelationProvider
No,MemoryStore putIteratorAsBytes may silently lose values when used with KryoSerializer because it does not properly close the serialization stream before attempting to deserialize the already serialized values which may cause values buffered in Kryo s internal buffers to not be read This is the root cause behind a user reported wrong answer bug in PySpark caching reported by Ben Leslie on the Spark user mailing list in a thread titled pyspark persist MEMORY ONLY vs MEMORY AND DISK MemoryStore putIteratorAsBytes may silently lose values when KryoSerializer is used
Yes,In logical plan SerializeFromObject for an array always use GenericArrayData as a destination UnsafeArrayData could be used for an primitive array This is a simple approach to solve issues that are addressed by SPARK Here is a motivating example Optimize SerializeFromObject for primitive array
Yes,The TaskMetricsUIData updatedBlockStatuses field is assigned to but never read increasing the memory consumption of the web UI We should remove this field Remove unused TaskMetricsUIData updatedBlockStatuses field
No,Because of this bug Python UDF will not work with ORDER BY and LIMIT Python UDF does not work between Sort and Limit
No,After updating Spark from to I found that it seems to have a memory leak on my Spark streaming application Here is the head of the heap histogram of my application which has been running about hours It shows that scala collection mutable DefaultEntry and java lang Long have unexpected big numbers of instances In fact the numbers started growing at streaming process began and keep growing proportional to total number of tasks After some further investigation I found that the problem is caused by some inappropriate memory management in releaseUnrollMemoryForThisTask and unrollSafely method of class org apache spark storage MemoryStore https github com apache spark blob branch core src main scala org apache spark storage MemoryStore scala In Spark x a releaseUnrollMemoryForThisTask operation will be processed only with the parameter memoryToRelease https github com apache spark blob branch core src main scala org apache spark storage MemoryStore scala L L But in fact if a task successfully unrolled all its blocks in memory by unrollSafely method the memory saved in unrollMemoryMap would be set to zero https github com apache spark blob branch core src main scala org apache spark storage MemoryStore scala L So the result is the memory saved in unrollMemoryMap will be released but the key of that part of memory will never be removed from the hash map The hash table will keep increasing while new tasks keep incoming Although the speed of increase is comparatively slow about dozens of bytes per task it is possible that result into OOM after weeks or months Inappropriate memory management in org apache spark storage MemoryStore may lead to memory leak
No,Check out the following ConcurrentModificationException Even though accumulators aren t thread safe they can be concurrently read while serializing executor heartbeats and modified while tasks are running leading to ConcurrentModificationException errors thereby leading to missing heartbeats or leading to inconsistent data since individual fields of a multi field object might be serialized at different points in time leading to inconsistencies in accumulators like LongAccum This seems like a pretty serious issue but I m not sure what s the best way to fix this An obvious fix would be to properly synchronize all accesses to the fields of our accumulators and to synchronize the writeObject and writeKryo methods but this may have an adverse performance impact Serialization of accumulators in heartbeats is not thread safe
No,Dataset joinWith is performing a BroadcastJoin on a table that is gigabytes in size due to the dataset logicalPlan statistics sizeInBytes i Seq i Seq i This is really not that long of a string toDS You might have to remove private sql from Dataset logicalPlan to get this to work val stats ds logicalPlan statistics yields stats org apache spark sql catalyst plans logical Statistics Statistics false This causes joinWith to performWith to perform a broadcast join even tho my data is gigabytes in size which of course causes the executors to run out of memory Setting spark sql autoBroadcastJoinThreshold does not help because the logicalPlan statistics sizeInBytes is a large negative number and thus it is less than the join threshold of I ve been able to work around this issue by setting autoBroadcastJoinThreshold to a very large negative number Dataset joinWith broadcasts gigabyte sized table causes OOM Exception
No,When using pivot and multiple aggregations we need to alias to avoid special characters but alias does not help because df groupBy C pivot A agg avg D as COLD max B as COLB show C bar avg D AS COLD bar max B AS COLB foo avg D AS COLD foo max B AS COLB small two two large two one Expected Output C bar COLD bar COLB foo COLD foo COLB small two two large two one One approach you can fix this issue is to change the class sql catalyst src main scala org apache spark sql catalyst analysis Analyzer scala and change the outputName method in Alias specified for aggregates in a pivot are not honored
No,The Pool Adjacent Violators Algorithm PAVA implementation that s currently in MLlib can take O N time for certain inputs when it should have worst case complexity of O N To reproduce this I pulled the private method poolAdjacentViolators out of mllib regression IsotonicRegression and into a benchmarking harness Given this input I vary the length of the input to get these timings Input Length Time us tests were performed using https github com sirthias scala benchmarking template I can also confirm that I run into this issue on a real dataset I m working on when trying to calibrate random forest probability output Some partitions take hours to run This isn t a skew issue since the largest partitions finish in minutes I can only assume that some partitions cause something approaching this worst case complexity I m working on a patch that borrows the implementation that is used in scikit learn and the R iso package both of which handle this particular input in linear time and are quadratic in the worst case IsotonicRegression takes non polynomial time for some inputs
No,write df passes everything in its arguments to underlying data source in x but it is not passing header true in Spark For example the following Additional arguments in write df are not passed to data source
No,ALTER TABLE RENAME PARTITION is unable to handle data source tables just like the other ALTER PARTITION commands We should issue an exception instead Issue Exceptions when ALTER TABLE RENAME PARTITION tries to alter a data source table
No,clockfly found the following corner case that returns the wrong quantile off by The value of the LEFT column represents the output when using QuantileSummaries in Window function the value on the RIGHT column represents the expected result The different between LEFT and RIGHT column is that the LEFT column does intermediate compression on the storage of QuantileSummaries QuantilesSummaries returns the wrong result after compression
No,The core info of an application in Master UI doesn t consider ApplicationInfo executorLimit It s pretty confusing that UI says Unlimited when executorLimit is set Master UI should show the correct core limit when ApplicationInfo executorLimit is set
No,select length select length these sql will return errors but hive is ok Error in query cannot resolve length due to data type mismatch argument requires string or binary type however is of int type line pos Error in query cannot resolve length due to data type mismatch argument requires string or binary type however is of double type line pos spark sql length return error
Yes,Many users have requirements to use third party R packages in executors workers but SparkR can not satisfy this requirements elegantly For example you should to mess with the IT administrators of the cluster to deploy these R packages on each executors workers node which is very inflexible I think we should support third party R packages for SparkR users as what we do for jar packages in the following two scenarios Users can install R packages from CRAN or custom CRAN like repository for each executors Users can load their local R packages and install them on each executors To achieve this goal the first thing is to make SparkR executors support virtualenv like Python conda I have investigated and found packrat http rstudio github io packrat is one of the candidates to support virtualenv for R Packrat is a dependency management system for R and can isolate the dependent R packages in its own private package space Then SparkR users can install third party packages in the application scope destroy after the application exit and don t need to bother IT administrators to install these packages manually I would like to know whether it make sense SparkR executors workers support virtualenv
