Yes,This issue aims to add bound function aka Banker s round by extending current round implementation Hive supports bround since Language Manual https cwiki apache org confluence display Hive LanguageManual UDF Add bround function
No,While poking around with I noticed that a few places still referred to spark assembly jar so I updated where it made sense I also updated the usage section of spark submit since you can now use run example argument to run an example from spark submit which was mostly undocumented Minor doc usage changes related to removal of Spark assembly
Yes,When you have an error in your R code using the RDD API you always get as error message Error in if returnStatus argument is of length zero This is not very useful and I think it might be better to catch the R exception and show it instead Improve error messages for RDD API
Yes,Right now filter push down only works with Project Aggregate Generate and Join they can t be pushed through many other plans Improve filter push down
Yes,We currently disable codegen for CaseWhen if the number of branches is greater than in CaseWhen MAX NUM CASES FOR CODEGEN It would be better if this value is a non public config defined in SQLConf spark sql codegen maxCaseBranches config option
Yes,Currently Union only takes intersect of the constraints from it s children all others are dropped we should try to merge them together Improve constraints propagation in Union
Yes,It will be great to have these SQL functions IFNULL NULLIF NVL NVL The meaning of these functions could be found in oracle docs SQL function IFNULL NULLIF NVL and NVL
Yes,In Spark DataFrame is an alias of Dataset Row MLlib API actually works for other types of Dataset so we should accept Dataset instead It maps to Dataset in Java This is a source compatible change Accept Dataset instead of DataFrame in MLlib APIs
Yes, refactor object operator framework to make it easy to eliminate serializations
No,right now the string of DataSourceScan is only HadoopFiles xxx without any information about the table name or path Since we have that in this is kind of regression Show table name or path in string of DataSourceScan
No,According to the Spark Code Style Guide https cwiki apache org confluence display SPARK Spark Code Style Guide SparkCodeStyleGuide Indentation this issue add a new scalastyle rule to prevent the followings Add a new scalastyle NoScalaDoc to prevent ScalaDoc style multiline comments
Yes,In order to upgrade to Kryo we need to shade Kryo in our custom Hive fork Shade Kryo in our custom Hive fork
Yes,We have ParserUtils and ParseUtils which are both utility collections for use during the parsing process Those name and what they are used for is very similar so I think we can merge them Also the original unescapeSQLString method may have a fault When u style character literals are passed to the method it s not unescaped successfully Merge ParserUtils and ParseUtils
Yes,Currently many functions do now show usages like the followings The only exceptions are cube grouping grouping id rollup window All functions should show usages by command DESC FUNCTION
Yes,Right now operations for an existing functions in SessionCatalog do not really check if the function exists We should add this check and avoid of doing the check in command SessionCatalog needs to check function existence
No,Because the concept of partitioning is associated with physical tables we disable all the supports of partitioned views which are defined in the following three commands in Hive DDL Manual https cwiki apache org confluence display Hive LanguageManual DDL LanguageManualDDL Create Drop AlterView An exception is thrown when users issue any of these three DDL commands Throw Exceptions for DDLs of Partitioned Views CREATE VIEW and ALTER VIEW
Yes,There is no unit test for KMeansSummary in spark ml Other items which could be fixed here Add Since version to KMeansSummary class Modify clusterSizes method to match GMM method to be robust to empty clusters in case we support that sometime See PR for SPARK Unit test for spark ml KMeansSummary
Yes,The time windowing function window was added to Datasets This JIRA is to track the status for the R Python and SQL API Dateset Time Windowing API for Python R and SQL
Yes, Decouple deserializer expression resolution from ObjectOperator
Yes,The toLocalIterator of RDD is super slow we should have a optimized implementation for Dataset DataFrame Add toLocalIterator for Dataset
Yes,We use a single object SparkRWrappers https github com apache spark blob master mllib src main scala org apache spark ml r SparkRWrappers scala to wrap method calls to glm and kmeans in SparkR This is quite hard to maintain We should refactor them into separate wrappers like AFTSurvivalRegressionWrapper and NaiveBayesWrapper The package name should be spakr ml r instead of spark ml api r Refactor GLMs code in SparkRWrappers
Yes,We use a single object SparkRWrappers https github com apache spark blob master mllib src main scala org apache spark ml r SparkRWrappers scala to wrap method calls to glm and kmeans in SparkR This is quite hard to maintain We should refactor them into separate wrappers like AFTSurvivalRegressionWrapper and NaiveBayesWrapper The package name should be spakr ml r instead of spark ml api r Refactor k means code in SparkRWrappers
No,Spark has some tests for compilation of Java sources using lambdas guarded behind a java tests maven profile but we currently do not build or run those tests As a result the tests no longer compile We should fix these tests and set up automated CI so that they don t break again Fix the java tests profile and run those tests in Jenkins
Yes,While running a Spark job which is spilling a lot of data in reduce phase we see that significant amount of CPU is being consumed in native Snappy ArrayCopy method Please see the stack trace below Stack trace org xerial snappy SnappyNative YJP arrayCopy Native Method org xerial snappy SnappyNative arrayCopy SnappyNative java org xerial snappy Snappy arrayCopy Snappy java org xerial snappy SnappyInputStream rawRead SnappyInputStream java org xerial snappy SnappyInputStream read SnappyInputStream java java io DataInputStream readFully DataInputStream java java io DataInputStream readLong DataInputStream java org apache spark util collection unsafe sort UnsafeSorterSpillReader loadNext UnsafeSorterSpillReader java org apache spark util collection unsafe sort UnsafeSorterSpillMerger loadNext UnsafeSorterSpillMerger java org apache spark sql execution UnsafeExternalRowSorter next UnsafeExternalRowSorter java org apache spark sql execution UnsafeExternalRowSorter next UnsafeExternalRowSorter java The reason for that is the SpillReader does a lot of small reads from the underlying snappy compressed stream and SnappyInputStream invokes native jni ArrayCopy method to copy the data which is expensive We should fix Snappy java to use with non JNI based System arrayCopy method in this case Significant amount of CPU is being consumed in SnappyNative arrayCopy method
Yes, Reimplement TypedAggregateExpression to DeclarativeAggregate
Yes,Currently a method submitStage for waiting stages is called on every iteration of the event loop in DAGScheduler to submit all waiting stages but most of them are not necessary because they are not related to Stage status The case we should try to submit waiting stages is only when their parent stages are successfully completed This elimination can improve DAGScheduler performance Eliminate unnecessary submitStage call
Yes, Execute multiple Python UDFs in single batch
No,It would be very helpful for network performance investigation if we log the time spent on connecting and resolving host Add logs to help investigate the network performance
No,SPARK adds a programatic way to dump generated Add SQL command for printing out generated code for debugging
Yes, remove trait Queryable
Yes,remove consumeChild always create code for UnsafeRow and variables Simplify whole stage codegen interface
Yes,We only parse create function command In order to support native drop function command we need to parse it too Parse Drop Function DDL command
Yes,In naive Bayes we expect inputs to be individual observations In practice people may have the frequency table instead It is useful for us to support instance weights to handle this case Support weighted instances in naive Bayes
Yes,It would be nice to refactor the MemoryStore so that it can be unit tested without constructing a full BlockManager or needing to mock tons of things Refactor MemoryStore to be testable independent of BlockManager
Yes, Improve SparkStatusTracker to also track executor information
Yes,They were kept in SQLContext implicits object for binary backward compatibility in the Spark x series It makes more sense for this API to be in SQLImplicits since that s the single class that defines all the SQL implicits Move StringToColumn implicit class into SQLImplicits
Yes,Currently for the key that can not fit within a long we build a hash map for UnsafeHashedRelation it s converted to BytesToBytesMap after serialization and deserialization We should build a BytesToBytesMap directly to have better memory efficiency Build BytesToBytesMap in HashedRelation
Yes,Currently spark history server REST API provides functionality to query applications by application start time range based on minDate and maxDate query parameters but it lacks support to query applications by their end time In this Jira we are proposing optional minEndDate and maxEndDate query parameters and filtering capability based on these parameters to spark history server REST API This functionality can be used for following queries Applications finished in last x minutes Applications finished before y time Applications finished between x time to y time Applications started from x time and finished before y time For backward compatibility we can keep existing minDate and maxDate query parameters as they are and they can continue support filtering based on start time range Add functionality in spark history sever API to query applications by end time
Yes,Per our discussion on the mailing list please see here http mail archives apache org mod mbox spark dev mbox CCA g F aVRBH WyyK nvBSLCMPtSdUuL Ge WW DnmnvY SXg mail gmail com E it would be nice to specify a custom coalescing policy as the current coalesce method only allows the user to specify the number of partitions and we cannot really control much The need for this feature popped up when I wanted to merge small files by coalescing them by size Add support for custom coalescers
Yes, make SubqueryHolder an inner class
Yes,When SortOrder does not contain any reference it has no effect on the sorting Remove the noop SortOrder in Optimizer Remove noop SortOrder in Sort
Yes,Per nongli s suggestions We should do these things Remove the non vectorized parquet reader code Support the remaining types just big decimals Move the logic to determine if our parquet reader can be used to planning Only complex types should fall back to the parquet mr reader Cleanup Extend the Vectorized Parquet Reader
Yes,We should add support for caching serialized data off heap within the same process i e using direct buffers or sun misc unsafe I ll expand this JIRA later with more detail filing now as a placeholder Add support for off heap caching
Yes,When a block is persisted in the MemoryStore at a serialized storage level the current MemoryStore putIterator code will unroll the entire iterator as Java objects in memory then will turn around and serialize an iterator obtained from the unrolled array This is inefficient and doubles our peak memory requirements Instead I think that we should incrementally serialize blocks while unrolling them A downside to incremental serialization is the fact that we will need to deserialize the partially unrolled data in case there is not enough space to unroll the block and the block cannot be dropped to disk However I m hoping that the memory efficiency improvements will outweigh any performance losses as a result of extra serialization in that hopefully rare case Incrementally serialize blocks while unrolling them in MemoryStore
No, hive tests should fail if SQL generation failed
No,The patch for SPARK added a number of MiMa excludes for cases which were missed due to our old way of programatically generating excludes in GenerateMIMAIgnore Before Spark we need to audit the additional excludes that I added to make sure that none represent unintentional incompatibilities which should be fixed Audit MiMa excludes added in SPARK to make sure none are unintended incompatibilities
Yes,This is to support order by position in SQL e g This should be controlled by config option spark sql groupByOrdinal Support group by ordinal in SQL
Yes,Separate out linear algebra as a standalone module without Spark dependency to simplify production deployment We can call the new module mllib local which might contain local models in the future The major issue is to remove dependencies on user defined types The package name will be changed from mllib to ml For example Vector will be changed from org apache spark mllib linalg Vector to org apache spark ml linalg Vector The return vector type in the new ML pipeline will be the one in ML package however the existing mllib code will not be touched As a result this will potentially break the API Also when the vector is loaded from mllib vector by Spark SQL the vector will automatically converted into the one in ml package Separate out local linear algebra as a standalone module without Spark dependency
Yes,Recently the fast serialization has been introduced to collecting DataFrame Dataset The same technology can be used on collect limit operator too Apply fast serialization on collect limit
Yes,Logging was made private in Spark If we move it then users would be able to create a Logging trait themselves to avoid changing their own code Alternatively we can also provide in a compatibility package that adds logging Move org apache spark Logging into org apache spark internal Logging
Yes,Because ClassTags are available when constructing ShuffledRDD we can use them to automatically use Kryo for shuffle serialization when the RDD s types are guaranteed to be compatible with Kryo e g RDDs whose key value and or combiner types are primitives arrays of primitives or strings This is likely to result in a large performance gain for many RDD API workloads Automatically use Kryo serializer when shuffling RDDs with simple types
Yes,This continues the work of SPARK SPARK and SPARK to expose R like model summary in more family and link functions Expose R like summary statistics in SparkR glm for more family and link functions
No,It s common for many SQL operators to not care about reading null values for correctness Currently this is achieved by performing isNotNull checks for all relevant columns on a per row basis Pushing these null filters in parquet vectorized reader should bring considerable benefits especially for cases when the underlying data doesn t contain any nulls or contains all nulls Filter rows with null attributes in parquet vectorized reader
Yes,Instead of storing serialized blocks in individual ByteBuffers the BlockManager should be capable of storing a serialized block in multiple chunks each occupying a separate ByteBuffer This change will help to improve the efficiency of memory allocation and the accuracy of memory accounting when serializing blocks Our current serialization code uses a ByteBufferOutputStream which doubles and re allocates its backing byte array this increases the peak memory requirements during serialization since we need to hold extra memory while expanding the array In addition we currently don t account for the extra wasted space at the end of the ByteBuffer s backing array so a megabyte serialized block may actually consume megabytes of memory After switching to storing blocks in multiple chunks we ll be able to efficiently trim the backing buffers so that no space is wasted This change is also a prerequisite to being able to cache blocks which are larger than GB although full support for that depends on several other changes which have not bee implemented yet Store serialized blocks as multiple chunks in MemoryStore
Yes,Currently Spark allows only a few cluster managers viz Yarn Mesos and Standalone But as Spark is now being used in newer and different use cases there is a need for allowing other cluster managers to manage spark components One such use case is embedding spark components like executor and driver inside another process which may be a datastore This allows colocation of data and processing Another requirement that stems from such a use case is that the executors driver should not take the parent process down when they go down and the components can be relaunched inside the same process again So this JIRA requests two functionalities Support for external cluster managers Allow a cluster manager to clean up the tasks without taking the parent process down Add support for pluggable cluster manager
Yes,Our code can go through SessionState catalog This brings two small benefits Reduces internal dependency on SQLContext Removes another public method in Java Java does not obey package private visibility More importantly according to the design in SPARK we d need to claim this catalog function for the user facing public functions rather than having an internal field Remove SQLContext catalog internal method
Yes,In general it is better for internal classes to not depend on the external class in this case SQLContext to reduce coupling between user facing APIs and the internal implementations Remove some internal classes dependency on SQLContext
Yes,DescribeCommand should just take a TableIdentifier and ask the metadata catalog for table s information Remove DescribeCommand s dependency on LogicalPlan
Yes,We introduced some local operators in org apache spark sql execution local package but never fully wired the engine to actually use these We still plan to implement a full local mode but it s probably going to be fairly different from what the current iterator based local mode would look like Let s just remove them for now and we can always re introduced them in the future by looking at branch Remove org apache spark sql execution local
Yes,When we generate code for join we copy the output row because there could be multiple output row from single input row We could avoid this copy when there is no join or the join will not generate multiple output rows from single input row Avoid the copy in whole stage codegen when there is no joins
Yes,When reading data from the DiskStore and attempting to cache it back into the memory store we should guard against race conditions where multiple readers are attempting to re cache the same block in memory Guard against race condition when re caching spilled bytes in memory
No,Given two task with M result on each it take more than seconds to fetch the results The RPC may be not designed to handle large block we should use block manager for that But currently this is based on spark rpc message maxSize which is usually very large M for safe it s too large for handling results We also counting the time to fetch the direct result also deserialize it as schedule delay it also make sense to only fetch much smaller blocks via DirectResult Fetch large directly result from executor is very slow
Yes,When generated code accesses a ColumnarBatch object it is possible to get values of each column from ColumnVector instead of calling getRow Direct consume ColumnVector in generated code when ColumnarBatch is used
Yes,If the Window does not have any window expression it is useless It might happen after column pruning Eliminate Unnecessary Window
Yes,We are using SELECT as a dummy table when the table is used for SQL statements in which a table reference is required but the contents of the table are not important For example In this case we will see a useless Project whose projectList is empty after executing ColumnPruning rule Remove Project when its projectList is Empty
Yes,RandomSampler sample currently accepts iterator as input and output another iterator This makes it inappropriate to use in wholestage codegen of Sampler operator We should add non iterator interface to RandomSampler Add non iterator interface to RandomSampler
Yes,Push down the predicate through the Window operator In this JIRA predicates are pushed through Window if and only if the following conditions are satisfied Predicate involves one and only one column that is part of window partitioning key Window partitioning key is just a sequence of attributeReferences i e none of them is an expression Predicate must be deterministic Predicate Push Down Through Window Operator
Yes,projectList is useless Remove it from the class Window It simplifies the codes in Analyzer and Optimizer Remove projectList from Windows
Yes,Today both the MemoryStore and DiskStore implement a common BlockStore API but I feel that this API is inappropriate because it abstracts away important distinctions between the behavior of these two stores For instance the disk store doesn t have a notion of storing deserialized objects so it s confusing for it to expose object based APIs like putIterator and getValues instead of only exposing binary APIs and pushing the responsibilities of serialization and deserialization to the client As part of a larger BlockManager interface cleanup I d like to remove the BlockStore API and refine the MemoryStore and DiskStore interfaces to reflect more narrow sets of responsibilities for those components Remove BlockStore interface to more cleanly reflect different memory and disk store responsibilities
Yes,When a cached block is spilled to disk and read back in serialized form i e as bytes the current BlockManager implementation will attempt to re insert the serialized block into the MemoryStore even if the block s storage level requests deserialized caching This behavior adds some complexity to the MemoryStore but I don t think it offers many performance benefits and I d like to remove it in order to simplify a larger refactoring patch Therefore I propose to change the behavior such that disk store reads will only cache bytes in the memory store for blocks with serialized storage levels There are two places where we request serialized bytes from the BlockStore getLocalBytes which is only called when reading local copies of TorrentBroadcast pieces Broadcast pieces are always cached using a serialized storage level so this won t lead to a mismatch in serialization forms if spilled bytes read from disk are cached as bytes in the memory store the non shuffle block branch in getBlockData which is only called by the NettyBlockRpcServer when responding to requests to read remote blocks Caching the serialized bytes in memory will only benefit us if those cached bytes are read before they re evicted and the likelihood of that happening seems low since the frequency of remote reads of non broadcast cached blocks seems very low Caching these bytes when they have a low probability of being read is bad if it risks the eviction of blocks which are cached in their expected serialized deserialized forms since those blocks seem more likely to be read in local computation Therefore I think this is a safe change Don t cache MEMORY AND DISK blocks as bytes in memory store when reading spills
Yes, QueryPlan expressions should always include all expressions
Yes,Right now we use PhysicalRDD for both existing RDD and data sources they are becoming much different we should use different physical plans for them Use different physical plan for existing RDD and data sources
Yes,A majority of Spark SQL queries likely run though HadoopFSRelation however there are currently several complexity and performance problems with this path Simplify and Speedup HadoopFSRelation
Yes,In preparation for larger refactorings I think that we should remove the confusing returnValues option from the BlockStore put APIs returning the value is only useful in one place caching and in other situations such as block replication it s simpler to put and then get Remove returnValues from BlockStore APIs
Yes,We need to submit another PR against Spark to call the task failure callbacks before Spark calls the close function on various output streams For example we need to intercept an exception and call TaskContext markTaskFailed before calling close in the following Changes to Spark should include unit tests to make sure this always work in the future Invoke task failure callbacks before calling outputstream close
Yes,Broadcast left semi join without joining keys is already supported in BroadcastNestedLoopJoin it has the same implementation as LeftSemiJoinBNL we should remove that Remove LeftSemiJoinBNL
Yes,After SPARK we should add Python API for generalized linear regression Python API for GeneralizedLinearRegression
Yes,We already have internal APIs for Hive to do this We should do it for SQLContext too so we can merge these code paths one day Track current database in SQL HiveContext
Yes,Remove all the deterministic conditions in a Filter that are contained in the Child Prune Filters based on Constraints
Yes,This is just a clean up task Today there are all these fields in SQLContext that are not organized in any particular way However since each SQLContext is a session many of these fields are actually isolated per session To minimize the size of these context files and provide a logical grouping that makes more sense I propose that we move these fields into its own class called SessionState Refactor Move SQLContext HiveContext per session state to separate class
Yes,After SPARK we should add Python API for MaxAbsScaler Python API for MaxAbsScaler
