No,There s a race in the globals The non global APIs from ZOOKEEPER are not available yet in a stable ZK version and there s no timeline for availability so for now it would help to make SM aware of other users of the global config ZKDelegationTokenSecretManager JaasConfig does not work well with other ZK users in process
Yes,Currently KMS audit log is using log j to write a text format log We should refactor this so that people can easily add new format audit logs The current text format log should be the default and all of its behavior should remain compatible Allow pluggable audit loggers in KMS
No,org apache hadoop fs s a TestS ATemporaryCredentials testSTS throws a AccessDenied when run without any AWS credentials access key and secret key in the config It fails because the InstanceProfileCredentialsProvider in the credentials chain on line is used but an instance profile always provides a temporary credential and GetSessionToken requires a long term not temporary credential Suggestion on how to fix this test case TestS ATemporaryCredentials testSTS error when using IAM credentials
No,Per the release instructions https wiki apache org hadoop HowToRelease we need to update hadoop project src site markdown index md vm to reflect the right versions new features and big improvements I can put together some notes for HADOOP and HDFS depending on others for YARN and MR Update release notes for alpha
Yes,In branch and later the patches for various child and related bugs listed in HADOOP most recently including HADOOP HADOOP HADOOP HADOOP and HDFS eliminate all use of commons httpclient from Hadoop and its sub projects except for hadoop tools hadoop openstack see HADOOP However after incorporating these patches commons httpclient is still listed as a dependency in these POM files hadoop project pom xml hadoop yarn project hadoop yarn hadoop yarn registry pom xml We wish to remove these but since commons httpclient is still used in many files in hadoop tools hadoop openstack we ll need to add the dependency to hadoop tools hadoop openstack pom xml We ll add a note to HADOOP to undo this when commons httpclient is removed from hadoop openstack In this was mostly done by HADOOP but the version info formerly inherited from hadoop project pom xml also needs to be added so that is in the branch version of the patch Other projects with undeclared transitive dependencies on commons httpclient previously provided via hadoop common or hadoop client may find this to be an incompatible change Of course that also means such project is exposed to the commons httpclient CVE and needs to be fixed for that reason as well remove unneeded commons httpclient dependencies from POM files in Hadoop and sub projects
No,h Error Message bq expected but was h Stacktrace quote java lang AssertionError expected but was at org junit Assert fail Assert java at org junit Assert failNotEquals Assert java at org junit Assert assertEquals Assert java at org junit Assert assertEquals Assert java at org junit Assert assertEquals Assert java at org apache hadoop security TestGroupsCaching testBackgroundRefreshCounters TestGroupsCaching java quote o a h security TestGroupsCaching testBackgroundRefreshCounters seems flaky
Yes,Update WASB driver to use the latest version of SDK for Microsoft Azure Storage Clients We are currently using version of the SDK Version brings some breaking changes Need to fix code to resolve all these breaking changes and certify that everything works properly Update WASB driver to use the latest version of SDK for Microsoft Azure Storage Clients
No,When IOException throws in getPassword getPassword return null String this will cause setConf throws java lang NullPointerException when check isEmpty on null string LdapGroupsMapping getPassward shouldn t return null when IOException throws
No,Fix up LICENSE and NOTICE after HADOOP Additional fix to LICENSE and NOTICE
Yes,Right now the git repo has a branch named master in addition to our trunk branch Since master is the common place name of the most recent branch in git repositories this is misleading to new folks It looks like the branch is from months ago We should remove it delete spurious master branch
Yes,Big features like YARN demonstrate that even senior level Hadoop developers forget that daemons need a custom OPTS env var We can replace all of the custom vars with generic handling just like we do for the username check For example with generic handling in place Old Var New Var HADOOP NAMENODE OPTS HDFS NAMENODE OPTS YARN RESOURCEMANAGER OPTS YARN RESOURCEMANAGER OPTS n a YARN TIMELINEREADER OPTS n a HADOOP DISTCP OPTS n a MAPRED DISTCP OPTS HADOOP DN SECURE EXTRA OPTS HDFS DATANODE SECURE EXTRA OPTS HADOOP NFS SECURE EXTRA OPTS HDFS NFS SECURE EXTRA OPTS HADOOP JOB HISTORYSERVER OPTS MAPRED HISTORYSERVER OPTS This makes it a consistent across the entire project b consistent for every subcommand c eliminates almost all of the custom appending in the case statements It s worth pointing out that subcommands like distcp that sometimes need a higher than normal client side heapsize or custom options are a huge win Combined with hadooprc and or dynamic subcommands it means users can easily do customizations based upon their needs without a lot of weirdo shell aliasing or one line shell scripts off to the side Deprecate HADOOP SERVERNAME OPTS replace with command subcommand OPTS
No,Hive does not compile against Hadoop SNAPSHOT Looks like the change in HADOOP causes this Incompatible change to SortedMapWritable
Yes, Update maven enforcer plugin version to
No,After HADOOP we are seeing mvn install DskipTests failing in branch branch and branch This failure is caused by the followings hadoop project module depends on hadoop build tools module but hadoop project module does not declare hadoop build tools as its submodule Therefore hadoop build tools is not built before building hadoop project hadoop build tools pom and jar are not uploaded to the snapshot repository https repository apache org content repositories snapshots org apache hadoop hadoop build tools The build failure occurs if the both of the above conditions are satisfied Add missing dependency in setting maven remote resource plugin to fix builds
Yes,Current ViewFileSystem does not support storage policy related API it will throw UnsupportedOperationException ViewFileSystem should support storage policy related API
No,Unit test TestTextInputFormat testSplitableCodecs failed when the seed is Stacktrace java lang AssertionError Key in multiple partitions at org junit Assert fail Assert java at org junit Assert assertTrue Assert java at org junit Assert assertFalse Assert java at org apache hadoop mapred TestTextInputFormat testSplitableCodecs TestTextInputFormat java BZip CompressionInputStream finds the same compression marker twice in corner case causing duplicate data blocks
Yes,In HADOOP the Guava cache was introduced to allow refreshes on the Namenode group cache to run in the background avoiding many slow group lookups Even with this change I have seen quite a few clusters with issues due to slow group lookups The problem is most prevalent in HA clusters where a slow group lookup on the hdfs user can fail to return for over seconds causing the Failover Controller to kill it The way the current Guava cache implementation works is approximately On initial load the first thread to request groups for a given user blocks until it returns Any subsequent threads requesting that user block until that first thread populates the cache When the key expires the first thread to hit the cache after expiry blocks While it is blocked other threads will return the old value I feel it is this blocking thread that still gives the Namenode issues on slow group lookups If the call from the FC is the one that blocks and lookups are slow if can cause the NN to be killed Guava has the ability to refresh expired keys completely in the background where the first thread that hits an expired key schedules a background cache reload but still returns the old value Then the cache is eventually updated This patch introduces this background reload feature There are two new parameters hadoop security groups cache background reload default false to keep the current behaviour Set to true to enable a small thread pool and background refresh for expired keys hadoop security groups cache background reload threads only relevant if the above is set to true Controls how many threads are in the background refresh pool Default is which is likely to be enough Reload cached groups in background after expiry
No,RetryInvocationHandler need wrap InterruptedException in IOException when call Thread sleep Otherwise InterruptedException can t be handled correctly by other components such as HDFS RetryInvocationHandler need wrap InterruptedException in IOException when call Thread sleep
No,truncate will fail when use viewFS Path should be like below return res targetFileSystem truncate f newLength should be return res targetFileSystem truncate res remainingPath newLength truncate will fail when we use viewfilesystem
Yes,This JIRA is to address Jing s comments https issues apache org jira browse HADOOP focusedCommentId page com atlassian jira plugin system issuetabpanels comment tabpanel comment in HADOOP AsyncCallHandler should use an event driven architecture to handle async calls
Yes,In current Async DFS implementation file system calls are invoked and returns Future immediately to clients Clients call Future get to retrieve final results Future get internally invokes a chain of callbacks residing in ClientNamenodeProtocolTranslatorPB ProtobufRpcEngine and ipc Client The callback path bypasses the original retry layer logic designed for synchronous DFS This proposes refactoring to make retry also works for Async DFS Support async call retry and failover
No,In single cluster setup document the grep job fails Grep job in Single Cluster document fails
Yes,This is a follow up jira from HADOOP Now with the findbug warning As discussed in HADOOP bq Why was this committed with a findbugs errors rather than adding the necessary plumbing in pom xml to make it go away we will add the findbugsExcludeFile xml and will get rid of this given kerby rc release Add the kerby version hadoop project pom xml bq hadoop project pom xml contains the dependencies of all libraries used in all modules of hadoop under dependencyManagement Only here version will be mentioned All other Hadoop Modules will inherit hadoop project so all submodules will use the same version In submodule version need not be mentioned in pom xml This will make version management easier Follow on fixups after upgraded mini kdc using Kerby
Yes,slaves sh and the slaves file should get replace with workers sh and a workers file replace slaves with workers
Yes,Upgrade yetus wrapper to be now that it has passed vote Upgrade to Apache Yetus
No,Currently there are two ways to achieve KMS HA The first one and the only documented one is running multiple KMS instances behind a load balancer https hadoop apache org docs stable hadoop kms index html The other way is make use of LoadBalancingKMSClientProvider which is added in HADOOP However the usage is undocumented I think we should update the KMS document to introduce LoadBalancingKMSClientProvider provide examples and also update kms site xml to explain it Mention LoadBalancingKMSClientProvider in KMS HA documentation
No,Many ASF projects include Apache in their logo We should add it to Hadoop Add Apache to Hadoop project logo
Yes,The hadoop ant code is an ancient kludge unlikely to have any users still We can delete it from trunk as a scream test for x Remove hadoop ant from hadoop tools
Yes,Currently the Future returned by ipc async call only support Future get but not Future get timeout unit We should support the latter as well Support Future get with timeout in ipc async calls
Yes,We should slim down the Docker image by removing JDK now that trunk no longer supports it remove JDK from Dockerfile
No,HADOOP pulled the dist copynativelibs script into an external file The call to this script is failing when running a distro build on Windows Windows distro build fails on dist copynativelibs
Yes,After DistCp copies a file it calls getFileStatus to get the FileStatus from the destination so that it can compare to the source and update metadata if necessary If the DistCp command was run without the option to preserve metadata attributes then this additional getFileStatus call is wasteful In DistCp prevent unnecessary getFileStatus call when not preserving metadata
Yes,We want to rename to alpha for the first alpha release However the version number is also encoded outside of the pom xml s so we need to update these too Change project version from to alpha
No,It s been noticed that Mini HDFS Cluster fails to start on trunk blocking unit tests and Jenkins Mini HDFS Cluster fails to start on trunk
No,Hi I m trying to use the append functionnality to an existing SequenceFile If I set Compression NONE it works when the file is created but when the file already exists I ve a NullPointerException by the way it works if I specify a compression with a codec Thansk Micka l Unable to append to a SequenceFile with Compression NONE
No,When I run hadoop trace command for a Kerberized NameNode it failed with the following error hdfs weichiu encryption root hadoop trace list host weichiu encryption vpc cloudera com WARN ipc Client Exception encountered while connecting to the server java lang IllegalArgumentException Failed to specify server s Kerberos principal name WARN security UserGroupInformation PriviledgedActionException as hdfs VPC CLOUDERA COM auth KERBEROS cause java io IOException java lang IllegalArgumentException Failed to specify server s Kerberos principal name Exception in thread main java io IOException Failed on local exception java io IOException java lang IllegalArgumentException Failed to specify server s Kerberos principal name Host Details local host is weichiu encryption vpc cloudera com destination host is weichiu encryption vpc cloudera com at org apache hadoop net NetUtils wrapException NetUtils java at org apache hadoop ipc Client call Client java at org apache hadoop ipc Client call Client java at org apache hadoop ipc ProtobufRpcEngine Invoker invoke ProtobufRpcEngine java at com sun proxy Proxy listSpanReceivers Unknown Source at org apache hadoop tracing TraceAdminProtocolTranslatorPB listSpanReceivers TraceAdminProtocolTranslatorPB java at org apache hadoop tracing TraceAdmin listSpanReceivers TraceAdmin java at org apache hadoop tracing TraceAdmin run TraceAdmin java at org apache hadoop tracing TraceAdmin main TraceAdmin java Caused by java io IOException java lang IllegalArgumentException Failed to specify server s Kerberos principal name at org apache hadoop ipc Client Connection run Client java at java security AccessController doPrivileged Native Method at javax security auth Subject doAs Subject java at org apache hadoop security UserGroupInformation doAs UserGroupInformation java at org apache hadoop ipc Client Connection handleSaslConnectionFailure Client java at org apache hadoop ipc Client Connection setupIOstreams Client java at org apache hadoop ipc Client Connection access Client java at org apache hadoop ipc Client getConnection Client java at org apache hadoop ipc Client call Client java more Caused by java lang IllegalArgumentException Failed to specify server s Kerberos principal name at org apache hadoop security SaslRpcClient getServerPrincipal SaslRpcClient java at org apache hadoop security SaslRpcClient createSaslClient SaslRpcClient java at org apache hadoop security SaslRpcClient selectSaslClient SaslRpcClient java at org apache hadoop security SaslRpcClient saslConnect SaslRpcClient java at org apache hadoop ipc Client Connection setupSaslConnection Client java at org apache hadoop ipc Client Connection access Client java at org apache hadoop ipc Client Connection run Client java at org apache hadoop ipc Client Connection run Client java at java security AccessController doPrivileged Native Method at javax security auth Subject doAs Subject java at org apache hadoop security UserGroupInformation doAs UserGroupInformation java at org apache hadoop ipc Client Connection setupIOstreams Client java more It is failing because TraceAdmin does not set up the property CommonConfigurationKeys HADOOP SECURITY SERVICE USER NAME KEY Fixing it may require some restructuring as the NameNode principal dfs namenode kerberos principal is a HDFS property but TraceAdmin is in hadoop common Or specify it with a new command principal Any suggestions Thanks TraceAdmin should support Kerberized cluster
No,An Oozie job with a single shell action fails may not be important but if you needs the exact details I can provide them with an error message coming from NodeManager The unsafe cast is here https github com apache hadoop blob e d ff e b c d b ed bc a hadoop common project hadoop common src main java org apache hadoop crypto key kms LoadBalancingKMSClientProvider java L Because of this ClassCastException an uncaught exception is raised we do not see the exact caused by exception message the oozie job fails YARN logs are not reported saved Handle ClassCastException on AuthenticationException in LoadBalancingKMSClientProvider
No,User Hadoop on secure mode login as kdc user kinit start firefox and enable Kerberos access http localhost logs Get authorization errors only hdfs user could access logs Would expect as a user to be able to web interface logs link Same results if using curl curl v negotiate u tester http localhost logs HTTP User tester is unauthorized to access this page so either don t show links if hdfs user is able to access provide mechanism to add users to web application realm note that we are pass authentication so the issue is authorization to logs suspect that logs path is secure in webdescriptor so suspect users by default don t have access to secure paths Add ability to secure log servlet using proxy users
Yes,LdapGroupsMapping currently does not set timeouts on the LDAP queries This can create a risk of a very long infinite wait on a connection Support timeouts in LDAP queries in LdapGroupsMapping
No,Please have a look following PreCommit build on branch https builds apache org job PreCommit HDFS Build artifact patchprocess patch asflicense problems txt Fix ASF License warnings in branch
No,We are generating a lot of javadoc warnings with jdk Right now the number is limited to Enlarge this limitation can probably reveal more problems in one batch for our javadoc generation process The number of javadocs warnings is limited to
No,hackage haskell org is pretty unreliable switch to fpcomplete s mirror quiet some of the output to make jenkins debugging easier some other random fixes cleanup the dockerfile
Yes,Currently FileSystem Statistics exposes the following statistics BytesRead BytesWritten ReadOps LargeReadOps WriteOps These are in turn exposed as job counters by MapReduce and other frameworks There is logic within DfsClient to map operations to these counters that can be confusing for instance mkdirs counts as a writeOp Proposed enhancement Add a statistic for each DfsClient operation including create append createSymlink delete exists mkdirs rename and expose them as new properties on the Statistics object The operation specific counters can be used for analyzing the load imposed by a particular job on HDFS For example we can use them to identify jobs that end up creating a large number of files Once this information is available in the Statistics object the app frameworks like MapReduce can expose them as additional counters to be aggregated and recorded as part of job summary Add a new interface for retrieving FS and FC Statistics
No,None of our bundled javascript dependencies are mentioned in LICENSE txt Let s fix that Add LICENSE txt entries for bundled javascript dependencies
No,As noted on HADOOP we lost the leveldbjni related NOTICE and LICENSE updates done in YARN when HADOOP was committed Let s restore them Restore lost leveldbjni LICENSE and NOTICE changes
Yes,The jira proposes an improvement over HADOOP to remove webhdfs dependencies from the ADL file system client and build out a standalone client At a high level this approach would extend the Hadoop file system class to provide an implementation for accessing Azure Data Lake The scheme used for accessing the file system will continue to be adl azuredatalake net path to file The Azure Data Lake Cloud Store will continue to provide a webHDFS rest interface The client will access the ADLS store using WebHDFS Rest APIs provided by the ADLS store Refactor Azure Data Lake Store as an independent FileSystem
No,When doing distcp of raw data using delete feature following bug appears The issue is not with the distributed copy the issue is when it tries to delete things in the target that no longer exist in the source it revalidates to make sure NONE is in the reserved raw domain Distcp with delete feature on raw data not implemented
No,HDFS showed that HDFS was return on read buf when there was no data left in the stream Java IO says bq If len is zero then no bytes are read and is returned otherwise there is an attempt to read at least one byte Review the implementations of IOStream buffer offset bytes and where necessary and considered safe add a fast exit if the length is Implementations of InputStream read buffer offset bytes to exit if bytes
Yes,Cross Frame Scripting XFS prevention for UIs can be provided through a common servlet filter This filter will set the X Frame Options HTTP header to DENY unless configured to another valid setting There are a number of UIs that could just add this to their filters as well as the Yarn webapp proxy which could add it for all it s proxied UIs if appropriate Add XFS Filter for UIs to Hadoop Common
No,Some work on S a has shown up that there aren t tests catching regressions in readFully reviewing the documentation shows that its specification could be improved review the spec review the implementations add tests proposed to the seek contract streams which support seek should support positioned readable fix code where it differs significantly from HDFS or LocalFS Specify PositionedReadable add contract tests fix problems
No,An example Some tests in org apache hadoop fs shell find occasionally time out
Yes,This allows metrics collector such as AMS to collect it with MetricsSink The per user RPC call counts schedule decisions and per priority response time will be useful to detect and trouble shoot Hadoop RPC server such as Namenode overload issues Support MetricsSource interface for DecayRpcScheduler Metrics
No,Update https hadoop apache org docs current hadoop project dist hadoop common FileSystemShell html with information about relative path and current working directory as suggested by yzhangal during HADOOP discussion FileSystemShell doc should explain relative path
Yes,As per comment https issues apache org jira browse HADOOP focusedCommentId page com atlassian jira plugin system issuetabpanels comment tabpanel comment from wheat in HADOOP Need to remove FileUtil copyMerge CC to wheat Remove FileUtil copyMerge
No,Creating a key that contains special character s in its name will result in failure when creating while that key is in fact created ok on the underlying key provider E g KMS key names are incorrectly encoded when creating key
No,I saw an OOM that appears to have been caused by the phantom references introduced for file system statistics management I ll post details in a followup comment PhantomReference for filesystem statistics can trigger OOM
Yes,In async RPC if the callers don t read replies fast enough the buffer storing replies could be used up This is to propose limiting the number of outstanding async calls to eliminate the issue Limit the number of outstanding async calls
No,Ref the comment here https issues apache org jira browse HADOOP focusedCommentId page com atlassian jira plugin system issuetabpanels comment tabpanel comment When run hadoop checknative it also failed Got something like below from log Fix bugs in the initialization of the ISA L library JNI bindings
No,andrew wang suggested that the current KMS ACL page is not very user focused and hard to come by without reading the and I agree So this jira puts more documentation to explain the current implementation Improve documentation on KMS ACLs and delegation tokens
Yes,HADOOP added a ShutdownHookManager to be used by different components instead of the JVM shutdownhook For each of the shutdown hook registered we currently don t have an upper bound for its execution time We have seen namenode failed to shutdown completely waiting for shutdown hook to finish after failover for a long period of time which breaks the namenode high availability scenarios This ticket is opened to allow specifying a timeout value for the registered shutdown hook ShutdownHookManager should have a timeout for each of the Registered shutdown hook
Yes,Currently the dfs test command only supports d e f s z options It would be helpful if we add w r to verify permission of r w before actual read or write This will help script programming Add w r options in dfs test command
Yes,Umbrella for converting hadoop hdfs mapred and yarn to allow for dynamic subcommands See first comment for more details Umbrella Dynamic subcommands for hadoop shell scripts
Yes,Currently back off policy from HADOOP is hard coded to base on whether call queue is full This ticket is open to allow flexible back off policies such as moving average of response time in RPC calls of different priorities Allow RPC scheduler callqueue backoff using response times
